1,Severe Thunderstorms and Flash Flooding Possible in the MidSouth and Midwest  WEATHER ENVIRONMENT CLIMATE NATURE
1,FedEx no longer to transport bioterror germs in wake of anthrax lab mishaps 
0,PapiiChampoo What I enjoy most about the Obama era is the civility Prez says GOP supports Iranian Death to  
0,NathanFillion Hardly 
1,"Reminder Mass murderer and white supremacist Anders Breivik was also unsurprisingly an antifeminist
"
0,"Blending the old with the new in Vanuatu to prepare for future emergencies 
 "
0,Worked at a fast food joint Poured burnt hot oil down the sink It hit the water in the trap and exploded  FallonTonight WORSTSUMMERJOB
0,Why tf did I decide to workout today My body feels like its been engulfed by a mass of fiery disdain
1,"Man wife get six years jail for setting ablaze niece
"
0,I let another love crash and burn
0,Posted a new song Earthquake  
1,4 dead dozens injured in Gaza blast near house leveled in summer war  Washington Post   World
0,Hw18 going 90100 Dude was keeping up with me Took the same exit Pulled to the side and told me he blew his motor Lolol 2fast2furious
0,Turn back to me I have rescued you and swept away your sins as though they were clouds Isaiah 4422 Contemporary English Version
0,In the movie Titanic Jack and Rose both could have stayed on the wooden beam without it sinking
0,Corey Robinson having some solid reps at RT although as I type this he got beat on lightning dip by T Walker
0,Hollywood movie about trapped miners released in Chile  ZippedNews 
0,spicybreads coxytown i tried downloading it and it crashed after the tutorial
0,Im feeling so attacked 
1,Crossborder terrorism Pakistan caught redhanded again  The Times of India 
0,Just us four can demolish this Createdunique23 KerenSerpa ArianaReed11  
0,USW The damage from abandoning the deal could well create a new level of uncertaintyeconomic upheaval  military unrest
1,Oops Bounty hunters try to raid Phoenix police chiefs home   A group of armed bounty 
1,Read  THE UNHEALED WOUNDS OF AN UNENDING CONFLICT Kashmir Pakistan India  EndOccupation EndConflict FreeKashmir
1,Back from Seattle Tacoma and Portland Whirlwind 
0,To ouvindo sleeping with sirens awn
0,IS ROSS DEAD NOOOOOOOOOOOO MikeParrActor
0,THIS IS RELAXING thunder SoothMySlumber WATERMELOANN populardemand w Soak Vine by thewebbeffect19 
1,This was Boston yesterday after an intense hailstorm XPost from rcityporn 4608ÌÑ2474 Û  
0,Credit to pfannebeckers for inspiring me to rediscover this fantabulous tbt 
1,Drones Under Fire Officials Offer 75000 Reward Leading To Pilots Who Flew Over Wildfire  photography arts
1,TeamFollowBack Madhya Pradesh Train Derailment Village Youth Saved Many Lives  FollowBack
0,Soap and education are not as sudden as a massacre but they are more deadly in the long run  Mark Twain
0,I Survived A 12Step Program for Sex Addiction  
0,Crackdown 3 Destruction Restricted to Multiplayer Crackdown 3 impressed earlier this week with a demonstratio 
0,holymileyray moonIighthunty Focus on Me is going to obliterate careers tea
0,Aftershock Protect Yourself and Profit in the Next Global Financial Meltdown by David Wiedemer http 
0,on town of salem i just melted ice cube bc im the arsonist D
1,I did another one I did another one You still aint done shit about the other one Nigga body bagging Meek
1,New warning for Central Hills 1 hail 60 mph winds NOT affecting Sturgis but could later tonight KOTAWeather 
1,That horrible sinking feeling when youÛªve been at home on your phone for a while and you realise its been on 3G this whole time
0,my brain id about to explode lmao
0,Theres a fly loose in my workspace with two bored cats I forsee terrible things  destruction badkitty thisiswhywecanthavenicethings
1,They are evacuating buildings in that area of State Road 20 We still dont have confirmation of what is on fire
0,  Cindy NoonanCindyNoonanHeartbreak in Baltimore Rioting YAHIstorical UndergroundRailraod
0,to Luka They should all die All of them Everything annihilated  Alois Trancy
0,On the 2nd year the officer team running the club collapsed A few influential members betrayed everyones trust severing the community
1,"Students at Sutherland remember Australian casualties at Lone Pine Gallipoli
  via theleadernews"
0,Do you know anyone looking to move to Hammond OR Share this listing 
1,TrustyMcLusty no passengers were on the derailed train But the who morning commute is fcked Go home
0,deb117 730 that catastrophe man opens school wanother hes an athlete not a teacher a principle not fulfilling any inside clerical duties
1,Jeff Locke Train wreck Fin disaster Fortunately the Pirates acquired a top quality starter in JA Oh wait Blowltan
0,Only had a crush on one girl in high school and she dont even realize it lol
1,Random wind gust just came through Gander  Probably some convection outflow  Havent heard any thunder yet but a few spits of rain nlwx
0,The more I listen to it the more I believe Casualties of Cool is one of the best albums there ever was
0,okay the cat has been quarantined in my bathroomits meowing really loud but I turned up the TV louderthings just might work out okay
1,HTML5 Beginners Crash Course  course 
0,That moment when you get on a scary roller coaster and the guy behind you is just screaming bloody murder  silverwood aftershock
1,Thanks a lot roadworks men cos a tube strike wasnt disruptive enough so having to walk the desolate route from Tottenham to 
0,SA MP Steel and ferrochrome industry on verge of collapse You dont even put that on list of questions to president for oral answer
0,"Aug 06 2015 Radio Show articles ÛÒ  
1 Eyewitness Account of Abortion Organ Harvesting by Planned Parenthood "
0,29 of oil and gas organizations have no realtime insight on cyber threats See how EY can help 
1,DoriCreates alhanda seems gov moonbeam between tokes blames bush for all the fires
0,harbhajansingh StuartBroad8 i cant believeis this d same stuart broad who was destroyed by our yuvi
1,Erdogans Bloody Gambit on July 20 a suicide bombing in Turkey took the lives of 31 socialists in SuruÌ¤  Shareaholic
0,I tried to save Mido Macia One of the murder accused has testified he tried to save Mido MaciaÛªs life 
1,Its a miracle that mankind survived 70 years since one of the worst days in its history All bets are off if it will survive the next 70
0,christinalavv lindsaywynn3 I just saw these tweets and I feel really attacked
1,Propertycasualty insurance rates up 1 in July After several months of no movement commercial propertycasu 
0,Thank you RicharkKirkArch AusInstArchitect for words of warning re QueensWharf Brisbane  via FinancialReview
1,billyhodge Aurora theater shooting trial Gunman expected notoriety for mass murder and nothing else  
0,Its baaaack  Petersens Bowhunting Battle of the Bows  Make sure you head on over and cast your vote for your 
0,Breast milk is the original superfood but rates worldwide have stalled below 40 contributing to more than 800000 child deaths last year
0,Floods Fishing Finally Sunshine  Fab Deals from Albertsons Anniversary Sale Lauren Paints  a beautiful life 
0,hermancranston WIRED  Reddit will now quarantine offensive content   Û
1,Method in contemplation of incident an leading bridal landslide wiWNpFXA 
0,"Come and join us Tomorrow
August 7 2015 at TranscendBlazing the Trail to the Diversified World of Marketing "
0,This nigga Cyhi diss was what Meek was suppose to do This shit actually fire
0,"MeryCormier haha Exactly Cosima is definitely in the hot seat Lol
Its Shay is no different from a bomb that got exploded"
0,sabcnewsroom sabotageI rule out structural failure
0,I I might buy my esoteric weapon for astrologian
1,Adult dies of plague in Colorado 
1,Worried about how the CA drought might affect you Extreme Weather Does it Dampen Our Economy 
1,ITS A TIE DYE EXPLOSION ON IG HELP ME IM DROWNING IN TIE DYE
1,Pakistans Supreme Court rules to allow military trials for suspects in terrorism cases 
0,Cute  all livin the life then you zoom in on ones face and you have a meme ready Ive seen the Gates of Hell and survived
0,"StephenGeorg Hey Stephen Remember that time you drowned all the yellows

Read "
1,"kunalkapoor Photo of the Day Storm
Chaser

photography pod"
0,Look for my Policy Matters Ohio report on CLE and Cuyahoga County blight and greening vacant lands soon  
1,See the 16yr old PKK suicide bomber who detonated bomb in Turkey Army trenchÛ  via MsOreo 
0,Arian Foster does keep his promise And thats to get injured every yeat
0,Four hundred wrecked cars costing 100 apiece were purchased for the making of this 1986 film  
0,Learn How I Gained Access To The Secrets Of The Top Earners  Used Them To Explode My Home Business Here  Please RT
0,A true TBT  Eyewitness News WBRE WYOU 
0,HOBO Hobo Vintage Shira Convertible BÛ 23800 bestseller 
0,kyrikoni ExpressandStar Who said veg and fruit was good for you Hope theres been no injuries or fatalities
1,Families to sue over Legionnaires More than 40 families affected by the fatal outbreak of Legionnaires disea 
0,Its lights out again with stagetwo load shedding Stagetwo load shedding will be in force between 5pm and 10pm 
0,"CCOT TCOT radiation Nuclear Emergency Tracking Center

"
0,If I get run over by an ambulance am I lucky justsaying randomthought
1,2 Cars Collide 1 Crashes Into Building Two cars collided at an intersection and that sent one vehicle crashingÛ 
1,Happy no one was hurt when wmata train derailed Also the express bus is so much better than metro rail  fox5newsdc
1,newhart2010 mudslide nuff said GBBO
1,FedEx no longer to transport bioterror germs in wake of anthrax lab mishaps  via usatoday
0,SidelineSavage what like a pipe made of peanut butter or a pipe you can smoke peanut butter out of
0,SonofBaldwin and hes the current Nova in the bookslast I checkedhe was tied into the books in 2011 after Rider died during Annihilation
1,Heat Advisory is In Effect From 1 PM Through 7 PM Thursday A Building Heat Wave and Increasing Humidity lawx 
1,"After death of Palestinian toddler in arson
attack Israel cracks down on Jewish"
1,"Prince Phillip said of the numbers of those murdered by the British at Amritsar

ÛÏThatÛªs a bit exaggerated it must include the woundedÛ"
0,More than a crush  WCE nykaeD  
1,Railways caught unawares by MP tragedy Accident spot never marked as vulnerable  Times ofÛ  News
1,PrablematicLA Adweek Im actually currently dressed for a snowstormdespite being in the middle of a Texas summer Thanks office AC
0,New illustration for the LA Times  illustration subway
0,Molecularly targeted cancer therapy for his LungCancer gave Rocky his life back  
1,Severe Thunderstorm Warning for Oklahoma County until 1030pm Radar here  okwx
1,I totally agree They rape kill destroy and leave land desolate Action needs to happen before the swarm swells 
0,YoungHeroesID Lava Blast  Power Red PantherAttack JamilAzzaini alifaditha
0,I had no issues uploading DEATH TO SMOOCHY or AWAKENINGS clips to YouTube but for some reason BICENTENNIAL MAN is being a pain in the ass
1,"Lindenow 315pm
Emergency crews are at a chemical spill in the main street near Church Street"
1,20 Earthquake in Sicily Italy iPhone users download the Earthquake app for more information 
0,WCCORosen did Lloyds of London insure your bet with CoryCove sinking twins
0,Savs contact fell out but she was convinced it didnt  went on to guage her eyeball out  now shes having a panic attack over caused damage
1,Severe hailstorm in progress over Northeast Logan County cowx 
0,Im hungry as a hostage
0,HearItFromPa Also pls help us w our campaign to warn the public about the hazardous keratin treatments The Brazilian Blowout COPYCATS
0,RockBottomRadFM As a kid I remember hearing rules about 30 to 90 days wo a defense and youre stripped Brock obliterated that
1,Myanmar s Displaced Rohingya at Sittwe point of no return  Prisonlike conditionsprivation 
0,4 Common Running Injuries and How to Avoid Them 
1,"ANNIHILATED IN DAMASCUS SYRIAN ARMY GRINDS Û÷ALLOOSH AND HIS GANG INTO THE MANURE PILE
"
0,another day another excellent dangerousbeans porridge seriously people blood orange in porridge is phenomenal
0,Woman electrocuted Red Redblood videoclip  
1,RoddyPiperAutos Fears over missing migrants in Med Rescuers search for survivors after a boat carrying as ma  
0,Want to work in Tarzana CA View our latest opening  Nursing Job Jobs Hiring
0,I think that none of us know the impact we have on the lives of those around us Even the slightest stirring can create a violent storm
0,Hellfire is surrounded by desires so be careful and donÛªt let your desires control you Afterlife islam
1,M194 0104 UTC5km S of Volcano Hawaii 
0,Queens Gambit went well until Anakin blew up the droid control ship Oh well still fun Cant Stop is next WBC2015
0,Dying with debt can be costly for survivors
1,Two giant cranes holding a bridge collapse into nearby homes  via 
0,San Bernardino I10 W Eo  Redlands Blvd Trfc CollisionNo Inj 
0,"But Oh 

How rich the soil

How wonderful the upheaval

ENTERSHIKARI"
0,in response to trauma Children of Addicts develop a defensive self  one that decreases vulnerability 3
1,Emergency 4 Harbor City Mod v452 6 Chemical Fire in Residential Area  via YouTube
0,chillimik HushLegs haha Are you really comparing yourselves to the emergency services Thats brilliant talk about up your own arse
0,Twister was fun 
0,Hollywood movie about trapped miners released in Chile
1,Plane from New York to Kuwait diverts to UK after declaring state of emergency 
0,Climate change could be catastrophic  but it does have some benefits Really weathernetwork 
0,If u faved that I hope you fall off a cliff 
1,usNWSgov Special Weather Statement issued August 05 at 1040PM EDT by NWS STRONG THUNDERSTORM WILL IMPACT 
0,SterlingKnight  Who had a car crashsterlingWho was driving in the carMel or JoeySterling Knight
1,Warne shocked over Australias epic collapse at Trent Bridge Johannesburg Aug 06 ANI Legendary Australian 
1,Avalanche City  Sunset  nowplay listen radio
0,The best Mind is clear content and observations for days  
0, small bag from the bottom the wounded hero shakes it A Senzu Bean falls from it GohanÛªs surprised Shakes the pouch once more but 
1,Sioux City Fire Officials Believe Bridge Collapse Lead To Cement Truck Roll Over  Siouxland Matters Siouxlan 
1,Still and Box alarm for the train derailment at 61st and Calumet struck out on the orders of 2121 ChicagoScanner
0,my ears are bleeding i hate stefano
1,030811 Police stop a 41yearold in the Bronx citing casing a victim or location No weapon is found
1,Even if u have your weapon and your badge we gonna put them choppas on your ass
1,Suresh Prabhu calls Harda derailment a natural calamity officials feel warning signs ignored Prabhu may regr 
0,jimmyfallon I crushed squirrel bones with a mortar and pestle for my schools bio dept not really sure why WorstSummerJob
1,Evacuation order lifted for town of Roosevelt  Washington Times 
0,DeeDeeCasey been on tour in the day to Hellfire caves Would love to investigate the place though
0,I was obliterated last night
0,alexbelloli I do It just seemed like the pages were out of order
0,Funds Needed for Rescued then Abandoned Cocker Spaniels 
0,Mere sight of a gun makes police ÛÒ and public ÛÒ more aggressive experts say 
0,"Entertain this thought for a moment

diarrhea hurricane"
1,1 of the major reason of suicide bombing is the absence of sexual interactions
0,mama Im still thugging the world is a war zone
0,Spot Flood Combo 53inch 300W Curved Cree LED Work Light Bar 4X4 Offroad Fog Lamp  Full reÛ  
1,dont get on I77 south huge wreck and airlift and maybe some deaths interstate is completely blocked
1,Deputies Man shot before Brighton home set ablaze 
0,Hijacking Electric Skateboards to Make Them SaferåÊ  scoopit 
0,If you wanna smoke cigs thats your own problem but when your breath smells like an old ash tray thats fucking disgusting
0,BBCNews mwlippert SouthKorea Dogs preparedElectrocutedboiling waterfur machine ALL STILL ALIVE 
0,master0fsloths has a crush 
1,Ignition Knock Detonation SensorSenso Standard KS94  
0,New SMP Ignition Knock Detonation Sensor KS315  
0,mcnabbychic I fear not for a while
1,Emergency responders prepare for chemical disaster through Hazmat training 
0,All Hail Lady Cheryl 24 Reasons You Should Be Obsessed With Cheryl Cole 
0,Shoot shit up till we see body bags
1,Man charged over fatal crash near Dubbo refused bail  via dailyliberal
0,My ear started bleeding again
1, Suicide Bombing Of European Union Car Kills At Least Three In Kabul on 
0,Survivors of Shanghai Ghetto reunite after 70 years   Shanghai China 
0,Vassalboro house to be razed to make way for public gazebo PeteLMcGuire reports 
0,dinallyhot Love what you picked Were playing WORTH IT by FIFTH HARMKID INK because of you Listen  Vote 
1,YoungHeroesID LAVA BLAST dan POWER RED PantherAttack Mirmanda11 evaaaSR
1,Families to sue over Legionnaires More than 40 families affected by the fatal outbreak of Legionnaires disea 
0,Ignition Knock Detonation SensorSenso Standard KS57  
0,DmoneyDemi I had my meltdown yesterday  Im going to miss you so much You are forsure my DTB for life When I get back watchout 
1,like for the music video I want some real action shit like burning buildings and police chases not some weak ben winston shit
0,FAIRx818x PlayOverwatch BlizzardCS please blizzard we love you
1,minimehh cjoyner I must be overlooking the burning buildings BlackLivesMatter
1,The Reagan Administration had arranged for Israeli weapons to be sent to the Guatemalan Army  
1,Punjab government flood relief platform  realtime information on inundation damages rescue efforts  travel alerts
1,Spokane authorities say theyre struggling to solve arson cases like todays on Hamilton  
1,At the 999day Emergency Services display Meeting the brave police firefighters and first responders that help keep us safe 
1,Greer man dies in wreck 
0,BESTSELLER Fossil Dawson Mini Cross Body Bag EsÛ 9800 
0,Dragon Ball Z Battle Of Gods 2014  Rotten Tomatoes  via RottenTomatoes
0,Ppl like unu feast today and famine tomorrow
0,GuiltyGearXXACP yeah I know but blaze blue dont have a twitter lol I drew this a few weeks ago 
0,Kevin Tan says hail to the chefs  Û and Green Pastures which features sustainable and organic cooking 
1,Well Saturn doesnt exist anymore So the collision place has a starting estimate of 4000 Thats 3 times what my car is worth
1,Police Officer Wounded Suspect Dead After Exchanging Shots  ABC News AN247
0,Autoinsurance industry clueless on driverlesscars  Markets  Money Times 
0,Whole slew of updated posts coming now that the hosting is fixed UnFML deluge
0,Taylor and Cara aka Catastrophe and Mother Chucker behind the scenes of Bad Blood Vote  VMAs 
0,Ugh So hungry Im going to demolish this food
0, FredOlsenCruise Please take the FaroeIslands off your itinerary until the mass murder of dolphins  whales stops
0,Rlyeh by Upheaval 
1,Aircraft debris confirmed to be from MH370  Nation  The Star Online 
0,Im awful at painting why did I agree to do an A3 landscape in bloody oils of all paints 
0,"Camera Art Photography  0215 New BoltåÊCyclone DR PP400DR Dual Outlet Power PackåÊFor External Camera Flash

30Û"
0,The Sharper Image Viper 24 Hardside Twister Black 
0,We walk the plank of a sinking ship
0,RealJaxClone screams
1,Sismo M 19  5km S of Volcano Hawaii Time20150806 010401 UTC20150805 150401 1000 at ep  CSismica
1,zaynmaIikist listen to hurricane
0,you wrecked my whole world
1,Mexico construction of bridge collapse killsåÊone  
0,"So again make sure to evacuate past the fire doors Any questions Yes
Why would we open the doors to the fire

III cant"
0,nikoniko12022 Breaking news Unconfirmed I just heard a loud bang nearby in what appears to be a blast of wind from my neighbours ass
0,One Direction Is my pick for  Fan Army Directioners  x1402
0,tanehisicoates even the second half has that great Greek Tragedy laced monologue by Charlize coulda been so much more
1,BMX issues Areal Flood Advisory for Shelby AL till Aug 5 900 PM CDT 
0,Tonight Its Going To Be Mayhem  4PlayThursdays Everybody Free w Text 1716 I ST NW 18 
0,Mane im not a Raiders Fan but they been in a drought They need to go 106 lol
0,Are the safety improvements being made to Route 198 in Buffalo doing more harm than good 
1,19 earthquake occurred 15km E of Anchorage Alaska at 0011 UTC earthquake Anchorage 
1,IDFire Parker Ridge Fact Sheet Aug 6 2015 Parker Ridge Wildfire Information Phone 2082676773 Email pa 
1,Children in Myanmar face a double catastrophe as floods hit the most  
0,chojo everyone hail to the pumpkin king
0,3 excessive engine failure rate significant maintenance constantly emerging structural defects Phew thats a lot I say
1,hot  Funtenna hijacking computers to send data as sound waves Black Hat 2015  prebreak best
0,IranDeal most members of Congress who dont want this deal dont have any kids who would b coming home in body bags War makes them money
1,Christian Attacked by Muslims at the Temple Mount after Waving Israeli Flag via Pamela Geller   
1,Floods cause damage and death across Asia  All media content    05082015 
0,James Kunstler How bad architecture wrecked cities  residualincome mlm 
0,You Bitches Walking Around Like Yall Hot Shit  Got Bed Bugs  You Burning 
0,sethalphaeus my personal favorites include paramore muse green day royal blood and 5sos
0,Reuters people like you should be charged after the inevitable rioting for contributing to it with your lies
0,General News Û¢åÊDemolition of houses on waterways begins at Achimota Mile 7  via 233liveOnline Full story at 
0,blazerfan not everyone can see ignoranceshe is Latinoand that is All she can ever benothing morebut an attack dog 4 a hate group GOP
0,I still have not heard Church Leaders of Kenya coming forward to comment on the accident issue and disciplinary measuresArrestPastorNganga
1,CONFIRMED Sanchez Hazard and Bolasie will be out for the rest of the season 
1,Swiss Kosher Hotel Bridge Collapse Injures Five People   JewishPress
0,If you told me ten years ago that Id be seeing anime on the big screen I probably would have exploded
1,Hiroshima bombing justified Majority Americans even today  Hindustan Times 
1,Damage to school bus on 80 in multi car crash BREAKING 
0,That moth that held me hostage yesterday has been chilling on the bathroom windowsill all day and Im not okay with this
1,Dust Storm en route from Alice Springs to Uluru 
0,7Beyonce Is my pick for  Fan Army Beyhive 
1, Krefeld the incident happened in a chemical industry park Emergency operations underway A building reportly collapsed cnnbrk ntvde
0,teahivetweets You would get inundated
1,He came to a land which was engulfed in tribal war and turned it into a land of peace ie Madinah ProphetMuhammad islam
0,Homukami Only URs and SRs matter Rs youll be drowning in Tho youre already drowning in Ns lol
1,New article Russian food crematoria provoke outrage amid crisis famine memories read more at here 
0,I also loved Bury my heart at wounded knee too TheGame
0,Become another casualty of society
1," 
Seems they declared war against government"
1,Evacuation order lifted for town of Roosevelt Wash though residents warned to be ready to leave quickly 
1,"Back to the future in Vanuatu how Cyclone Pam has encouraged traditional ways of living
 "
0,I HATE WHEN IM TRYING TO STRAIGHTEN MY HAIR AND MY BROTHER COMES SWOOPING IN BEHIND ME AND SCARES ME I JUST BURNED MY FINGER
0,Deeeznvtzzz bring the body bags tho
0,Bigamist and his Û÷firstÛª wife are charged in the deaths of his Û÷secondÛª pregnant wife her child 8 her mother her nephew 1 and their uÛ
0,"This is an evil generation
Rock and roll evacuation
As far as the eye can see
Hey hey hey hey"
1,news Britons rescued amid Himalaya floods 
0,JYHeffect my good you stay in NY 
0,Sweet2Young I came in Had he fucking moved his entire existence wouldve been obliterated
0,"How many men would a human hew if a human could hew men

popular tongue twister among woodchucks"
0,Beware of your temper and a loose tongue These two dangerous weapons combined can lead a person to the Hellfire islam
0,Lyf needs quality and a certain sense of security Being with a person you cant trust can only cause stress and emotional upheaval
1,UnrealTouch fuck sake john Jesus my heart just sunk
1,At least 180 dead a million displaced in India floods  India  ReliefWeb 
0,ON THE USE OF PERFORATED METAL SHEAR PANEL SFOR SEISMICRESISTANT APPLICATIONS 
1,Police Monitoring 200 Jihadis in Poland  via freedomoutpost
0,Buyout Giants Bid To Derail å£6bn Worldpay IPO ÛÒ SkyåÊNews 
0,Im a cyclone passion overblown 
0,Pandemonium In Aba As Woman Delivers Baby Without Face Photos 
1,wild night in the village of pugwash every fire truck is out that the town has which is like a fire truck for every house population6
0,ZachZaidman 670TheScore wld b a shame if that golf cart became engulfed in flames boycottBears
0,CaIxxum5SOS thanks for the damn heart attack
0,"Its okay I welcome the rain 
Gave you all the storm that you could weather"
1,halljh1720 I am so sick of criminals parents and friends rioting when they are killed by police You dont give a Damn when officer is
0,OpTicScumper Yo why u so sexy
0,Which is true to an extent The obliteration of white privilege would reduce unfair favoritism
0,New technology designed to help prevent dangerous police chases In an effort to reduce injuries Milwaukee policeÛ 
1,Obama Declares Disaster for TyphoonDevastated Saipan Obama signs disaster declaration for Northern Marians a 
1,"Zotar50 skeleton alchemist was electrocuted to death by Atamathon the Giant Golem on Golem Graveyard 1
"
0,ML 20 SICILY ITALY  euroquake
1,Boulder deputies are waiting for the bomb squad to detonate grenade like this one found in Stearns lake today 
1,Lets not forget our wounded female veterans 
