0,DK Eyewitness Travel Guide Denmark travel guide eBay auctions you should keep an eye on 
0,samajp32 really needs to tone it down some in the weight room RT SoonerSportsTV Demolition cont 
1,The Murderous Story Of AmericaÛªs First Hijacking Earnest PletchÛªs coldblooded killing ofÛ 
1,Very sad to learn of the derailment of 2 trains in MpMy deepest condolences to the families who lost loved ones in this Mishap OfficeOfRG
1,chrisroth98 chaselabsports in an emergency situation late in the year Not as a plan in camp
0,engineermataRAI ate mataas kc ratingbut they did not think on doing like this they destroy the story along with the ratings
0,DDNewsLive NitishKumar  and ArvindKejriwal cant survive without referring narendramodi  Without Mr Modi they are BIG ZEROS
0,I liked a YouTube video  Darude  Sandstorm
0,"AberdeenFC AberdeenFanPage 

Good luck to the  tomorrow night 

Get some coefficient points plz 
Armageddon"
0,I gained 3 followers in the last week You Know your stats and grow with 
1,Islamic State group in Egypt threatens to kill Croat hostage 
0,MariaSherwood2 JohnJCampbell Mega bloody marvellous
1,Mass murderer Che Guevara greeting a woman in North Korea 
1,illegal alien released by ObamaDHS 4 times Charged With Rape  Murder of Santa Maria CA Woman Had Prior Offenses  
0,Everything has sunk in except the fact that I am actually moving to the state of Colorado tomorrow Been dreaming of it since I was a kid
1,Latest Landslide kills three near Venice after heavy rain 
1,Slashandburn blamed for bush fires in western St Thomas  
0,Were hiring Read about our latest job opening here RN Nurse Shift Manager Emergency Services  Full time  
1,Pandemonium In Aba As Woman Delivers Baby Without Face Photos  
1,Landslide in Italian Alps kills three ROME Reuters  Three people were killed when a severe rainstorm in th 
0,ZXAThetis Are you okay I electrocute you TOO badly right
1,UD Rescue Structural Collapse  Scott Road  Ypres Road York 14 Trucks
0,Do you have a plan in case of a pool chemical emergency Learn more here  watersafety CDC
0,I liked a YouTube video from slimebeast  Town of Salem  How to Win as The Arsonist
0,when you are quarantined to a little corner bc you are too sick to be in the office but work is piling up and they need you kinda day
0,realDonaldTrump to obliterate notion  pattern political style seemly lead voter beliefs Sarcasm Narcissism RichHomeyDon Swag USA LIKES
1,Flood and Mudslide Warning for East Fjords  Iceland Review  icelandreview via icelandreview
0,13 reasons why we love women in the military    lulgzimbestpicts  
1,w NEMA warns Nigerians to prepare for drought 
1,nar phuket Ultimate preparedness library  Prepare Yourself For Any Catastrophe Over 
0,hot  Funtenna hijacking computers to send data as sound waves Black Hat 2015  prebreak best
0,What Natural Disaster Are You When You Get Angry 
0,The Drowning Girl by Caitlin R Kiernan Centipede Press Signed numbered Limited  Full reÛ  
0,Fear Factory in December Done deal
1,My prediction for the Vikings game this Sundaydont expect a whole lot Infact I think Zimmer goal isinjury free 1st game
1,2Leezy its like youre about to fall down a cliff but youre grabbing my hand but my palms are sweaty  Why bruh 
0,Get a load of this welfare loving spongea blight on society 
1,Watch This Airport Get Swallowed Up By A Sandstorm In Under A Minute 
1,Reddit Will Now Quarantine Offensive Content  
0,Super loud thunder woke me up from my very nice nap
1,9 Mile backup on I77 Southaccident blocking the Right 2 Lanes at Exit 31 Langtree Rdconsider NC 115 or NC 150 to NC 16 as alternate
1,Enjoying a little golf this summer Take care to avoid injury  back and shoulder injuries can happen quickly 
0,I hate this damn Milwaukee IndyFest All the cars sound like a really long tornado siren going off and it woke me up from my nap
0,JagexHelpDibi update JAG enabled but a hijacker has access might be what I was looking for Fingers crossed
0,AmazonDeals Skylanders Trap Team Flip Wreck Character Pack  down 453 045 to 949 from 994 Sale 
0,"Know them recognize themthen obliterate them 
gym gymflow gymtime team assassinsÛ "
0,Honestly nightmarish God driving to new places is always stressful as shit  i hate it so much Ugh Almost crashed a few times
0,Dear CanonUSAimaging I brought it  CanonBringIt Fire  CanonTattoo MN TheresMoreWhereThatCameFrom 
0,Its Run From Sirens by Half Hour Hotel halfhourhotel Edgarsgift Premium Promotion OFFER 
0,Trust us to get rescued by the dopey ones  Emmerdale  SummerFate
0,Theres still room for you at our party for first responders from around the country 3rd annual best ever 
0,indiepopmom I CANT BREATHE MY LUNGS COLLAPSED
0,theres a fire truck in this parking lot
0,"Left hand side of a diamond is a graveyard shift have to attack and defend
The right handside no have to do that too you fucking idiot"
0,My biggest fear is disappointing the people who believe in me
0,asukager magical bag of blazing
1,Christian Attacked by Muslims at the Temple Mount after Waving Israeli Flag via Pamela Geller   
1,jeesss Ethereal7 Hello 911 yeah we have someone drowning here send a medic 
1,Patriot Survival Guide Do you know how survive when the governments collapse or other natural disaster happens 
1,OMG NIXON LIVES That is Richard M Nixon Tricky Dicky right there in the picture isnt it Hiding in Calgary he 
1,Learning from the Legacy of a Catastrophic Eruption  via newyorker
0,blanksocietyx emmerdale IM SCREAMING HES MY FAVOURITE
1,5 dead 3 missing 103 families evacuated due to floods in Bukidnon  
0,First wreck today So so glad me and mom are okay Couldve been a lot worse So happy the lord was with us today 
1,Boy 11 charged with manslaughter in shooting death of Elijah Walker The 11yearold appeared Wednesday in a 
0,Thief Broke Front Window Of Hicksville Store Stole 50 Cell Phones Fled Crashed Into 
0,Police walk up on me I be blowin smoke in dey face  wanna lock me up cus I got dope shit is gay
1,UN No more GujaratRiot  MumbaiRiot9293 which devastated 10001000 Indianperpetrated by Modi  ChawalChorbjp UNWomen  UNNewsTeam
0,Womens Cross Body Messengers Bags Clutch Small Shoulders Zippers Bags White  
0,alexandrapullin It is indeed If the apocalypse comes this week I know where Ill be 
0,Deadpool is already one of my favourite marvel characters and all I know is he wears a red suit so the bad guys cant tell if hes bleeding
1,    MH370 Aircraft debris found on La Reunion is from missing Malaysia Airlines   
1,Tornadoes El Nino may give Canadas twister season a boost Toronto 
0,"MEGALPOLIS Area Petting Party Shiver 
Fear Instant  GLOBAL Inundation OVERFLOW
WAS Commencement WRITE  "
1,Heres what may have caused a Metro train to derail in downtown DC 
0,Hellfire We donÛªt even want to think about it or mention it so letÛªs not do anything that leads to it islam
1,DT georgegalloway RT Galloway4Mayor ÛÏThe CoL police can catch a pickpocket in Liverpool Stree 
1,USGS EQ M 12  23km S of Twentynine Palms California Time20150805 235409 UTC20150805 16  EarthQuake
0,BehindAShield WarsGoddess Sweet Lord  I collapse as my knees buckle
0,ÛÏParties and body bags go together like drinking and drivingÛ
0,PPFA At least they arent burning buildings and looting stores
1,It looks like a mudslide poor thing  greatbritishbakeoff
1,SigAlert North  Southbound 133 closed btwn 5 fwy and Irvine Blvd due to truck fire CHP is detouring traffic
0,Set goals  DEMOLISH them all 
1,Anyone missing their license plate Two stolen ones found on terrorists car 
0,The Blazing Elwoods BlazingElwoods  Dont Bother Me Dougs Song Tune 
1,"Tricycle toddler atomic bomb
 In a fraction of a second Our decisions change the landscape of humanity"
0,It still hasnt sunk in that i will never see my nan again how has it been 2 months already 
1,"Militants attack police post in Udhampur 2 SPOs injured

Suspected militants Thursday  attacked a police post in "
0,LightningWolf You really have Activity Directory P
1,I was on my way to Gary but all the Chicago entrances was closed due to a bridge collapsed  I hope they let us through tomorrow
0,PYDisney que crushMTVHottest Justin Bieber
0,NowPlaying  Cliff Richard  I Could Easily Fall In Love With You  Shadows  Internet Nieuws Radio On 
0,AtLarnxx but he DIDNT
0,I had school today and Ive already had a panic attack Thank you high school for sucking 
0,THESE AFTER BATTLE ANIMATIONS ARE SO FUCKING MUCH
0,The mixtape is coming i promise We goin in right now 
0,The rbcinsurance quote website  disaster Tried 3 browsers  3 machines Always get Missing Info error due to a nonexistant drop down
0,On Thursday at 0025 we updated our kml of 2D and 3D seismic exploration vessels offshore oil 
0,So the Ahamedis think the Messiah had already come 125 years ago Where is Armageddon Where is the Dajaal Where is Gog  Magog
1,713pm MAPLERIDGE Lougheed Hwy EB is closed between 203rd and Dewdney Trunk Rd because of Collision ETO is between 800 PM and 900 PM
1,DirkNoMissSki yea but if someone faints why are they panicking thats basic stuff 
0,RonWyden Democrats restricted  Blacks from Voting In 48 Landslide Lyndon Johnson won Senate Election by 67 Votes of Dead People in Texas
0,duchovbutt StarbuckScully MadMakNY davidduchovny yeah we survived 9 seasons and 2 movies Lets hope for the good Theres hope 
1,Civilian Casualties in Afghanistan Reach Record High  
0,Nick Williams just hit another bomb Just crushed it
1,Politics DemocracyÛªs hatred for hate Û Dawabsha threaten to erode Israeli democracy Homegrown terrorism ha  
1,Chernobyl disaster  Wikipedia the free encyclopedia dont you just love the nuclear technology its so glorious  
0,tubestrike derailed you Our robertwelch cutlery offers will get you back on track  
1,Food crematoria provoke outrage amid crisis famine memories 
0,My mantra this morning Heading out to Make a whirlwind trip down southÛ 
1,MartinMJ22 YouGov When did a 12 seat majority with 36 of the vote become a landslide
1,"Vladimir Putin Issues Major Warning But Is It Too Late To Escape Armageddon
"
1,Watch This Airport Get Swallowed Up By A Sandstorm In Under A Minute 
1,New Documents Found Pointing To Japans WWII Atomic Bomb Program 
0,RobertONeill31 Getting hit by a foul ball while sitting there is hardly a freak accident Its a war zone
1,OUN continues Severe Thunderstorm Warning for Oklahoma OK till 1030 PM CDT 
1,Crash and burn  
1,Chiasson Sens cant come to deal ColoradoAvalanche Avalanche  
0,"4 Printable Emergency Plan Templates
"
0,Well me and dad survived my driving 
0,"RT OurMotherMary Short Reading

Apocalypse 211023 

In the spirit the angel took me to the top of an enormous high mountain and Û"
1,Police investigating after an ebike collided with a car in Little Portugal Ebike rider suffered serious nonlife threatening injuries
1,"RT kotowsa South SudanÛªs war on women survivors say rape has become just a normal thing 
 "
1,RT kurtkamka Beautiful desolation Just me a couple of coyotes some lizards and the morning sun Phoenix ArizÛ 
1,Arson suspect linked to 30 fires caught in Northern California  via latimes
0,adriennetomah how did people survive like that
0,Doofus diamorfiend im jokin still cant be on moves
1,Fotoset elanorofrohan 10th December 2013 Green Carpet in Zurich for the Swiss Premiere of The Desolation 
0,Anti Collision Rear technology cool 
0,Guys he can run so fast he creates a tornado WITHOUT BREAKING A SWEAT He makes Superman look like a slowpoke He can be a POC
1,Good way to end the day Geyser plus dust storm 
1,I see a massacre
1,AKILAH WORLD NEWS Cop pulls man from car to avoid this  
1,ROCK SPRINGS ÛÒ Residents living off Elk Street continue to battle flooding issues after MondayÛªs rain storm WhileÛ 
1,Fatality 
0,sriramk DLin71 pmarca Tragedy of commons pertains to public ownership Not property rights based markets The opposite of what you say
1,Yelp Bolsters Health Care Reviews With Investigative Journalism Sick and injured patients at a local ER are t 
0,A slamming door and a lesson learned I let another lover crash and burn
1,NWS has issued a Severe Thunderstorm Warning for OklahomaOK until 1030 PM
1,Abes government made clear that grenades were not weapon
1,Storm in RI worse than last hurricane My city3others hardest hit My yard looks like it was bombed Around 20000K still without power
0,ACOUSTICMALOLEY no he was blazing it
1,AvBronstein Popehat instapundit KurtSchlichter Also are you aware of the casualty estimates for an invasion of Japans home islands
1,Dr Bengston on wildfire management ÛÏnumbers and size of fires areas affected and costs of fighting them all show upward trendÛ smem
1,brianroemmele UX fail of EMV  people want to insert and remove quickly like a gas pump stripe reader 1 person told me it crashed the POS
0,"sakuuchiha YaBoiLuke 

Screams and gets a face full of Saku genitals"
0,acee DAEM GIRL SMOOTH ASF c 
1,Burning buildings Media outrage 
1,breakingnews Rly tragedy in MP Some live to recount horror ÛÏWhen I saw coaches of my train plunging into wa 
0,New Expansion Ideas  Bard Class Holy Trinity  1 
0,Flat out bomb by FlavaFraz21 whatcanthedo
0,"Is there a night curfew on campus

Find out here  "
1,Police Officer Wounded Suspect Dead After Exchanging Shots Richmond police officer wounded suspect killed a 
0,The  Peoples  Republic  Of  China    PROC   Abandon the West Philippine Sea and all the   via ChangePilipinas
1,Moderate drought is spreading rapidly across central Ga Macon WarnerRobins Dublin Milledgeville gawx 
1,Rocky fire in Northern California swells to 60000 acres 12000 evacuated  Portland Phoenix Miami Atlanta Casper
0,Did Josephus get it wrong about Antiochus Epiphanes and the Abomination of Desolation Read more 
1,Police Officer Wounded Suspect Dead After Exchanging Shots  
0,Ignition Knock Detonation SensorSenso Standard fits 0206 Acura RSX 20LL4  
1,Medieval airplane hijacker testa earnings the distinction divers HtaRvrGLY
0,UptownJorge head up like yo nose bleeding
0,New post People are finally panicking about cable TV 
0,Ahrar Al Sham In our negotiations with Iran over Al Zabadani they wanted all Sunnis evacuated out of Al Zabadani
0,God damn it I electrocuted myself 
0,"So if I capsize on your thighs high tide B5 you sunk my battleship
"
0,SirensIcebreaker What is one fantasy work about a diverse heroine that you think everyone should read 
1,There might be casualties tomorrow
0,justicemalala nkeajresq Nkea destroyed lives in Gambia as a mercenary judge
0,I thought the loudest goal I ever screamed was Higuains offside goal against Germany
1,Families to sue over Legionnaires More than 40 families affected by the fatal outbreak of Legionnaires disea 
0,Beat the heat Today only Kill Cliff Free Fall 2 Pick up a cold drink today after the tough crossfit 
0,Of what use exactly is the national Assembly Honestly they are worthless We are derailed
1,Arovolturi3000 survived because of magic  she is searching the wood for survivors outside of London
0,kabwandi Breaking news Unconfirmed I just heard a loud bang nearby in what appears to be a blast of wind from my neighbours ass
1,Chinas Stock Market Crash Are There Gems In The Rubble  forbesasia
0,Why did God order obliteration of ancient Canaanites 
0,Fur Leather Coats sprite  weapon of choice was a lifestyle chosen back in 02 
0,batfanuk we enjoyed the show today Great fun The emergency non evacuation was interesting Have a great run
0,SCREAMING MariahCarey ArianaGrande 
0,I think Twitter was invented to keep us insomniacs from rioting in the wee small hours
1,Wreckage Conclusively Confirmed as From MH370 Malaysia PM Investigators and the families of those who were 
1,museawayfic beenghosting xylodemon ok ok what if I make the close quarters an abandoned cabin in the woods IN A THUNDERSTORM
0,The fing things I do for GISHWHES Just got soaked in a deluge going for pads and tampons Thx mishacollins 
1,When the answer my friend isnt blowing in the windITS YELLING How to Survive a Dust Storm  
0,Chinas Stock Market Crash Are There Gems In The Rubble 
1,Afghanistan sharp rise in women and children casualties in first half of 2015 
1,Big Top Burning The True Story Of An Arsonist A Missing Girl Û   
0,One Direction Is my pick for  Fan Army Directioners 
1,WFP  WFP Delivers Food To 165000 Bangladesh Flood Victims After Tropical Cyclone Komen DHAKA ÛÒThe United Na 
1,"Totoooooo Totoooooooooo
Historicalmages Dust storm approaching Stratford Texas 18th April 1935 "
0,holy crap KingMyth1999 my phone just exploded haha
1,FedEx not willing to transport research specimens of potential bioterror pathogens in wake of anthrax lab mishaps  
0,0day bug in fully patched OS X comes under active exploit to bypass password   Ars Technica 
1,hot  C130 specially modified to land in a stadium and rescue hostages in Iran in 1980  prebreak best
0,keampurley thirst has no curfew
0,San Antonio Stars head coach Dan Hughes was just carted to the locker room after one of his guards collided with 
1,Omg if Cain dies i will be an emotional wreck emmerdale
0,Calum5SOS you look like you got caught in a rainstorm this is amazing and disgusting at the same time
1,Pilot Dies In Plane Crash At Car Festival  via YouTube Crash Aircraft Airplane Pilot Death Accident CarFest
0,Two Jewish Terrorists Charged In HistoricChurch Arson  The Ugly Truth  
0,JaxMK2 Stage FatalityUUDLK Close
0,"New Free Porn Clip Taking Of Hostages Dangerous For Favors Free 

RT adult sex tube"
1,12 of the deaths in redlight running crashes are pedestrians bicyclists  other vehicle occupants that are hit by the redlight runners
1,SIGALERT UPDATE 3N133 CLOSED AT 5 FWY UFN TRASH TRUCK FIRE
0,When the Last Tree Is Cut Down the Last Fish Eaten and the Last Stream Poisoned You Will Realize That You 
1,Families to sue over Legionnaires More than 40 families affected by the fatal outbreak of Legionnaires disea 
0,GrowingUpSpoiled going clay pigeon shooting and crying because of the aftershock
0,"BloodbathTV favourite YouTube channel going right now
Love everything you guys do and thank you introducing me to Dude Bro Party Massacre"
1,"Must get hot in burning buildings

loses followers "
1,"Revise the Death to America scenario 

While theres 500 American casualties by Iranian activity SUSPECTED "
1,"City implores motorists not to speed after more reports of animal fatalities near nature reserves
 "
0,TBT to that time my best friend and I panicked at the disco 
1,Lightning strike in the distance via rpics  pics 
0,"Remaining Sections Of Greystone Psychiatric Hospital Under Demolition 
Pic 85885473 "
0,Man why hasnt machinegunkelly blown up Hes still underground
0,the kids at the orphanage were obviously not too traumatised 
1,Cant fix stupid MT CBCCalgary Dont drive through flooded underpasses warns city as it enacts Municipal Emergency Plan yyc abstorm
0,"I got evacuated from the cinema 30 mins through Inside Out
Kill me please"
0,Attack on Titan game on PS Vita yay Cant wait for 2016
0,What a feat Watch the BTS of kallemattsons incredible music video for Avalanche  
1,The Latest More Homes Razed by Northern California Wildfire  ABC News 
1,godsfirstson1 and she wrapped his coat around herself It practically engulfed her
1,Vickie627 Desert Storm was an unqualified victory a treaty was signed  Under Clinton the situation only got worse and more violent tcot
0,TroySlaby22 slicker than an oil spill
0,Im there Bride  Groom on mountain cliff edge Ha Ha just kidding I WILL NOT EVER be there Ha Ha  
0,Im setting myself up for disaster
0,Aftershock back to school kick off was great I want to thank everyone for making it possible What a great night
0,iCASEIT  MFi Certified Lightning Cable  1m  
1,133 N past  the 5 L lane is reopened All other lanes are closed All lanes are open on the 133 S Trash truck fire cleanup KNX1070
0,girlthatsrio have my uncles wreck their shit
1,Malaysian Officials Say Debris Found on Reunion Island Is From MH370 BillNeelyNBC reports 
0,No better feeling than seeing and being on stage with my day ones 22 year friendships and we still body bagging mics together
0,DrMartyFox     In the US government and Libs made evil good and good evil We will reap the whirlwind Lord have mercy on us
1,FAAN orders evacuation of abandoned aircraft at MMA 
0,Beach Reads in August Giveaway Hop  StuckInBooks is giving away any book in Mayhem series  
0,Womens Flower Printed Shoulder Handbags Cross Body Metal Chain Satchel Bags Blue  
1,Passengers evacuated  lanes blocked off as power lines come down over a Gold Coast tram 9NewsGoldCoast 
0,NWSPocatello BG16 So far brunt of storm just to our north Grayed out w dust  rain to N blue sky interspersed w clouds to S
0,Most of us ddnt get this English  RT ReIgNCoCo The World Is Inundated With Ostentatious People Stay Woke
1,psd special Olap world pres  How To Recognize A Hazardous Waste And The Multidimensi 
1,Families to sue over Legionnaires More than 40 families affected by the fatal outbreak of Legionnaires disea 
1,Meek Mill responds to DrakeÛªs OVO Fest set with wedgie threat 
0,Spot Flood Combo 53inch 300W Curved Cree LED Work Light Bar 4X4 Offroad Fog Lamp  Full reÛ  
1,iNWS Alert SPSGSP from 852015 1040 PM to 1115 PM EDT for Pickens County STRONG THUNDERSTORM WILL IMPACT 
1,Lone Survivor The Eyewitness Account of Operation Redwing and the Lost Heroes of SEAL TeamÛ  
0,Doone Silver Architects has won permission to demolish Birminghams Natwest Tower and replace it with what will be cityÛªs tallest building
0,Uribe demolished that ball 
0,Reddit Will Now Quarantine Offensive Content Reddit cofounder and CEO Steve Huffman has unveiled more specif 
0,adorableappple No reported flooding po in the area Ten4 mmda
0,Speaking of memorable debates 60Second KnowItAll Ronald Reagans landslide romp on Election Day in 1980 m 
0,"Pharma overloaded with a loud cry like an emergency siren 

fucking"
0,Bleachers entire set has been one big game of The Stage Is Lava 
0,Detonation quotes  my esteemed belt quotes regarding each one recent EseVU 
0,DelDryden If I press on the twitch will my head explode
0,Shot Through The Heart XV You are going to totally give love a bad name with this heart pierc  
1,RT TrueDiagnosis 250K deaths per year from physician error  How to avoid being one of them 
0,Cyclist who collided with runner on Roanoke greenway wins 300000 civil verdict  via roanoketimes
0,Reddit Will Now Quarantine Offensive Content  Technology technews puledotechupdate
0,Wen I finally get the girl I want Im flooding yall wit all pics of us Rs tho
0,do he love me do he love me not I aint a playa I just crush a lot
0,POTUS you until you drown by water entering the lungs You being alive has caused this great country to fall to shit because youre a pussy
1,HassanRouhani Wars doomed to destruction loss money must invest in Irans inside that should not go outside
1,Twelve feared killed in Pakistani air ambulance helicopter crash 
0,Hope Doretts mudslide cake wins GBBO
0,fatal attraction
1,Fears over missing migrants in Med Rescuers search for survivors after a boat carrying as many as 600 migrantsÛ 
1,News  The Latest More Homes Razed by Northern California Wildfire  New York Times  TAFS FB100
0,saynae angel or arson
1,Rt hirochii0 There is no country that making fun of Hiroshima s tragedy but Korea  Indonesia Malaysia Jamaica Û
1,Rightways Building structural integrity  failure inspections damages defects testing  repair  via rightwaystan
0,Tell the United Nations Plantations are NOT forests  via RainforestResq
1,Disregard my snap story there is an angry white girl riot happening as we speak evacuate
0,Over half of poll respondents worry nuclear disaster fading from public consciousness  fukushima
0,They sky was ablaze tonight in Los Angeles Im expecting IG and FB to be filled with sunset shots if I know my peeps
0,christie keeps telling me that i need to be electrocuted
1,DEEP crew to help with California wild fires  via thedayct
0,"thus making FemaleGilgameshs assault useless
The spears collided with the dark force however did not penetrate

Due to the dark "
0,Earthquake drill 
1,New Giant Flames GIANT FULL BLACK PANTOFEL infoorder sms087809233445 pin23928835   pictwittercompNPiZoDY
0,Skarletan åÇ the storm A violent swell of emotions then nothing
0,Even then our words slip and souls coincide Finer than subatomic spells Just as we collide 
1,Washington Post  4 dead dozens injured in Gaza blast near house leveled in summer war 
1,Alleged East Bay serial arsonist arrested SanFrancisco  
1,Some of worst radiation exposure from Fukushima meltdown happened 47km northwestProof that small emergency planning zones donÛªt cut it
1,Do you feel like you are sinking in low selfimage Take the quiz  
1,hmm 12000 Nigerian refugees repatriated from Cameroon  
0,Emotionally I am destroyed
0,Poway hcg diet ensures mole obliterated whensoever nevermore comes above sizYgwWF
0,Zouma just flattened that guy
1,Senators calling for emergency housing Boxer Feinstein back plan to move homeless vets to VA campus 
1,Metro still doesnt know when Blue  Orange lines will reopen Empty passenger car derailed  5 am NOT a new 7000series CQnow WMATA
1,Michael5SOS haha so would you say its so hot your balls are burning off
0,"INFO Baekhyun and Suho will be attending the Idol Sports Championship on August 10th
Cr SYJEXO 
 "
1,Signing a petition to seek mercy on a death punishment for a convivted terrorist is a job well done in India But asking a foreign govt 1n
1,Accident center lane blocked in SantaClara on US101 NB before Great America Pkwy BayArea Traffic 
0,MentalTwitter Note Make sure my smoke alarm battery is up to snuff at all times or face many twitter reminders of changing my battery
1,Myanmars president urged people to leave a lowlying southern delta region on Thursday with rain water that has inundated much of the counÛ
1,Earthquake and tsunami that occurred in Japan free speech is also swallowed 
