0,kirstiealley AnimalAdvocate Or pay it for a photo safari no weapons allowed Otherwisethey just like to kill something
1,myGC Broken powerlines evacuate Gold Coast tram suspend services 
0,Chilli heat wave Doritos never fail
0,The worst part is seeing lightning and trying to guess when the thunder will crack
0,When I was cooking earlier I got electrocuted some crucial  now Im psychic lol
0,Do Your Own Thing The Battle of Internal vs External Motivation 
0,Why is there an ambulance right outside my work
1,Top insurer blasts lack of Australian Govt action on disaster mitigation  via smh
0,Im an emotional wreck right now
0,beautiful disaster 
0,Casperrmg BestComedyVine whats cracking cuz
1,Dramatic Video Shows Plane Landing During Violent Storm   
1,Flood Advisory in effect for Shelby County in AL until 9 PM alwx 
0,What if every 5000 wins in ranked play gave you a special card back Would be cool for the long teÛ 
0,I ruin everything 
0,smokers that ruin that new car smell 
0,The Prophet peace be upon him said Save yourself from Hellfire even if it is by giving half a date in charity
0,GrowingupBlack walking past chicken frying was like entering a war zone
0,uriminzok The coming catastrophe of the destruction of the puppet republic half naemolgo continue to firmly support Yiraneuni and against
1,These wild fires out west are crazy
0,Just realized my dude OnlyFTF was on that What Are Those way before it blew up  the tusky  game robsimss CantMissKid
0,Magic City Mayhem Kissimmee adventures  Aug 5 2015 
0,Reddit Will Now Quarantine OffensiveÛ  onlinecommunities reddit amageddon freespeech 
0,Factors to Consider When Hiring a Demolition Company nOxDV
0,asymbina tithenai Im hampered by only liking crossbody bags I really like Ella Vickers bags machine washable 
0,Ali you flew planes and ran into burning buildings why are you making soup for that man child BooRadleyVanCullen
1,Metepec Mexico  NIGHT DISASTEREOficial  NitClub mÌ¼sica mÌ¼sica 
0,The 8Minute FatBurning Routine ThatÛªs Also Really Fun  fat weightless  fatburning burnfat skinny workout
1,Reality Training Train falls off elevated tracks during windstorm 
0,Neighbor kids stopped to watch me play Disneys I Lava You song on my uke Left as I got into Journeys Dont Stop Believing kidsthesedays
0, GidiExclusixe Shock In Aba As Woman Delivers Û÷FacelessÛª Baby Photo There was pandemonium  BennyCapricon
1,A brief violent storm swept through the Chicago area Sunday afternoon leading to one death and an evacuation of Lollapalooza and more
1,70 Years After Atomic Bombs Japan Still Struggles With War Past The anniversary of the devastation wrought b 
0,Lol The real issue is the the way the NFL is trying to ruin this guys legacy 
0,USArmy has entered into the JAGM project to replace TOW and Hellfire missiles Check it out here 
1,Suicide bomber detonates in Saudi Arabia mosque 17 reportedly killed  
0,Nuu that FAM fwt Im Leave You In a Body bag
1,WWII Memories Plus Lessons of Hiroshima We Still Need Nuclear Weapons  denver billings rapidcity seattle cheyenne
0,When you see your crush in the stands Vine by KhadiDon 
0,Romantic dramatic but never panic original sensei write rhymes in the attic
1,Lightning strike in the distance via rpics  pics
1,Pic of 16yr old PKK suicide bomber who detonated bomb in Turkey Army trench released  
1,An IS group suicide bomber detonated an explosivespacked vest in a mosque inside a Saudi special forces headquarters killing 15 people
1,I agree with certain cultural appropriation things but honestly if u looked at my house it screams appropriation bc Buddhas and stuff
0,Okay maybe not as extreme as thunder and lightning but pretty much all other types FIFA16  
0,Jeep Cherokee Owners File Lawsuit Against Fiat Chrysler Harman After Hackers   The Consumerist  mcgsecure
1,Critters climate and two plague deaths in Colorado 
0,RT NASASolarSystem Jupiters Red Spot is a violent storm larger than the entire Earth  
0,"Check out Want Twister Tickets AND A VIP EXPERIENCE To See SHANIA CLICK HERE at  
I would Love Love Love To win"
0,spinningbot Are you another Standuser If you are I will have to detonate you with my Killer Queen
0,I liked a YouTube video  Kalle Mattson  Avalanche Official Video
1,burned 129 calories doing 24 minutes of Walking 35 mph brisk pace myfitnesspal
1,Vagersedolla visits villages recently bombed by Turkey and finds people fed up with the PKK 
0,Womens Satchel Lattice Chain Studded Cross Body Multi Colour Shoulder Bags Blue  
1,Governor weighs parole for California school bus hijacker  
0,Read this already in 14 but it was and remains one of my favorite articles ever LetÛªs Like Demolish Laundry 
0,Its always super awkward when worlds collide
0,bomairinge EluTranscendent straight body bagging
1,Rare insight into terror and How to fight it  Cameroon USA Whitehouse ES FR Nigeria UK Africa DE CA AU JP
1,Christian Attacked by Muslims at the Temple Mount after Waving Israeli Flag via Pamela Geller   
0,Battlefield 4 Funny Moments  Dukes of Hazard Undercover Soldier MAV T  via YouTube
1,M157 0111 UTC3km NNW of Lake Henshaw California 
0,this Popeyes bout to get crushed 
0,Bayelsa poll Tension in Bayelsa as Patience Jonathan plans to hijack APC PDP Plans by former First Lady and 
0,Why Some Traffic Is Freezing Cold And Some Blazing Hot ÛÒ And How To Heat Up Some Of Your Traffic 
0,Safyuan just a minor citation for possesion of a decriminalized substance im not facing any time
1,PolicyLab is at CECANFs last public hearing in NYC today and tomorrow to address child abuse and neglect fatalities 
1,Maj Muzzamil Pilot Offr of MI17 crashed near Mansehra today May Almighty give strength to family to bear the loss 
1,incident with injuryI495  inner loop Exit 31  MD 97Georgia Ave Silver Spring
1,usNWSgov Severe Weather Statement issued August 05 at 1038PM EDT by NWS THE SEVERE THUNDERSTORM WARNING  
0,When your heart is bigger than the obstacles  in front of you euro dontexpectnothing july fire euro
1,ModiMinistry Madhya Pradesh Train Derailment Village Youth Saved Many Lives 
1,all that panicking made me tired  i want to sleep in my bed
1,Watching a man electrocuted on the roof of mumbailocals is definitely a lesson People please learn lessonforlife marinelines mumbai
0,Doing dialyses to my grandpa and oh lord this blood makes me light headed
1,California man facing manslaughter charge in Sundays wrongway fatal crash in    Ca 
0,Fr cuz I risk being electrocuted every shower  
1,TodayÛªs storm will pass let tomorrowÛªs light greet you with a kiss Bask in this loving warmth let your soul return to bliss
0,Follow EdWelchMusic and check out his Hit Single Unpacked Man its BLAZING
0,LukeBox something about first responders military they are our true Heros Besides your music
0,I See Fire
0,I have a rising follower graph 2 more followers in the past week Get your stats right here 
0,Dead Space  Obliteration Imminent 22  via YouTube
1,Mmmmmm Im burning Im burning buildings Im building Oooooohhhh oooh ooh
1,ameenshaikh3 by ur logic if bridge didnt collapse then second train engine should cross bridge then  sanjaynirupam sureshprabhu
1,The majority of those killed were civilians on the ground after the jet first bombed the citys main street then dramatically plummeted
0,amaramin3 Meek is definitely capable of body bagging his ass on the track Drake was just smooth as fuck with it
0,meltdown of proportions commences I manage to calm myself long enough to turn the waters to hot and wait for the steam to cloud my vision
1,FYI CADFYI ACCIDENT PROPERTY DAMAGEWPD1600 S 17TH ST
1,Breaking news Haunting memories drawn by survivors 
1,SJ GIST 148 Houses Farm Produce Destroy  StreetjamzDotNet  
0,Hunger hits me and I cant function probably wouldnt last long in famine zonesthank God
0,A new favorite Desolate 2 by r3do  on SoundCloud
0,NHS England announces new plan to meet emergency care targets 
1,"Officials say a quarantine is in place at a Birmingham home over a possible Ebola case

Edward Khan of the "
0,I added a video to a YouTube playlist  World Of Tanks  Battle Assistant Mod Bat Chat Arti kaboom
0,kirkmin after listening to you demolish BartHubbuch on weei I cant wait to bait my patriot hater coworkers into a Brady discussion
0,quote Never let your problems ruin your faith
1,Governor allows parole for California school bus hijacker Local  
0,WoundedPigeon  Detonate by ApolloBrown ft MOP
0,Top link Reddits new content policy goes into effect many horrible subreddits banned or quarantined 
0,Statistically Im at more of risk of getting killed by a cop than I am of dying in an airplane accident
1,C130 specially modified to land in a stadium and rescue hostages in Iran in 1980    submitt  aviationaddicts
0,Zicac Vintage Leather Briefcase Messenger Satchel Tote Cross Body Handbags for Womens 
0,am boy Crash  
0,oooureli AbuBaraa1 You mean like the tolerance you showed when sharing democracy with the Iraqis Wait you mutilated and bombed them
1,Savings and sewing in Guatemala Savings and sewing in Guatemala When a natural disaster hit seamstress Elvia  
0,"charminar demolish if it in falling state anyway take engineers opinion
Telangana"
1,DavidVitter Hi David in 2003 I saw the USA walk into a war that destroyed the lives of millions You can prevent a repeat IranDeal
0,Set some goals Then demolish them  fitness inspiration
0,So now that Di Maria has left my dear mufc  back to the HazardDi Maria argument Id say Hazard is way better  idc
1,Killing Black Babies at Planned Parenthood wheres the demonstrations looting of PP burning down the buildings Black Babies Lives Matter
1,Rebelmage2 Im glad you got away XD But My be safe was in reference to a tornado near calgary and drum heller at around 4 O
1,Schools in Western Uganda still Burning down Buildings during StrikesStrikes in Western Uganda always Lit literally
1,The Fake of Nanking Massacre4 Eyewitnesses English   Obama Clinton Bush GOP ABC CBS BBC CNN WSJ WPO
1,hot  Funtenna hijacking computers to send data as sound waves Black Hat 2015  prebreak best
0,Think Akwa Ibom DonÛªt come to Uruan and demolish buildings again exAssembly member warns Udom Emmanuel  
0, Igers 3 words that wrecked Disneys stock  
0,DatTomm the funniest part about that twitter is the feminists that try to attack it 4Head
0,Yessum Im traumatised 
0,Shes kinda hot played on the radio today Whats next Disease to all The apocalypse has started everyone Be careful
0,michaelgbaron how come scott rice doesnt get another shot Holding lefties to a 184 average Is he injured
1,KapoKekito on northgate by the taco truck thats fire
0,NowPlaying Rock You Like A Hurricane  Scorpions 
0,Summer is lovely
0,Is inner man wayward on route to harm spent replacing online surveys qZLOreMfT
0,cjbanning 4sake of argsuppose preborn has attained individl rightsGenerally courtof law forbids killing unless dead person did something
0,Im On Fire  
1,US National Park Services Tonto National Forest Stop the Annihilation of the Salt River Wild Horse  via Change
1,"Massacre at Sinjar  Has the World Forgotten the Yazidi 

 yazidishingalgenocide EzidiGenocide"
1,California wildfires force thousands to evacuate  via YouTube
1,Japan Marks 70th Anniversary of Hiroshima Atomic Bombing 
0,World Annihilation vs Self Transformation  Aliens Attack to Exterminate Humans 
0,KirCut1 lets get a dope picture together and have the dopest explosion 
1,0 Photo LASTMA officials challenge police for driving against traffic in Lagos 
0,A traumatised dog that was found buried up to its head in dirt in France is now in safe hands This is such a 
1,A good piece on Israeli incitement and Jewish terrorism by Beinart 
0,Womens Tote Faux Leather Handbags Shoulder Cross Body Top Handle Bags Rose  
0,Im just going to say it Under the new reddit policy changes I think rconspiracy will be quarantined and how thats bad for the truth mÛ
1,MOREOSHA officers on siteinvestigating Noranda explosion KFVS12 News Cape Girardeau Carbondale Poplar Bluff 
1,Police Officer Wounded Suspect Dead After Exchanging Shots Richmond police officer wounded suspect killed after exchange of gunfire
1,May Allah help all those suffering from the Pakistan floods You and your families are in our Dua
1,Salvation Army hosts rally to reconnect fathers with children The Salvation Army is hosting a back to school rallyÛ 
0,fouseyTUBE you ok Need a ambulance Hahahah that was good 
0,Would have just flattened the little midget  
0,New item Pillow Covers ANY SIZE Pillow Cover Grey Pillow Pillows Premier Prints Lulu Storm Grey by MyPillowStudio Û 
1,Police Teenagers arrested for curfew violations in Evanston were riding stolen bicycles Two teenagers taken into cus  Chicago news
1,Afghanistan sharp rise in women and children casualties in first half of 2015 
0,Finna storm Fuck my back boutta start hurting like a mf 
1,Wall of noise is one thing  but a wall of dust Moving at 60MPH  How to not get blown away 
0,Today was trauma on top of trauma on top of  trauma in Richmond so I know work is going to be crazy the next two days
1,The Murderous Story Of AmericaÛªs First Hijacking 
0,Various issues fail to derail homes bid 
0,localarsonist diamorfiend the legal system NEVER forgets
1,Discovered Plane Debris Is From Missing Malaysia Airlines Flight 370  TIME 
1,VIDEO Were picking up bodies from water Rescuers are searching for hundreds of migrants in the Mediterran 
0,Sex Workers Say Credit Card Bans On Online Ads Do More Harm Than Good 
1,CIVIL WAR GENERAL BATTLE BULL RUN HERO COLONEL 2nd NEW HAMPSHIRE LETTER SIGNED   
0,joshacagan Your only option now is to move to an desolate island with nothing but a stack of DVDs you canÛªt watch
0,morehouse64 It appears our Govt has lost an Ethical and or moral relevance This means the whole USA population is in danger from them
1,Theres an emergency evacuation happening now in the building across the street
0,Curfew really helps If you think about it  BC
1,On 1st August Turkish jets bombed the village Zergele in Qendil and killed 8 civilians and 15 others wounded
0,Wrinkled the face of deluge as decayed
0,My Quora answer to Why do my answers get collapsed when others dont 
1,Obama Declares Disaster for TyphoonDevastated Saipan Obama signs disaster declaration for Northern Marians a 
0,The year is 2065 and the national society of meme preservation has opened the first museum where memes and their origins are displaced
0,Fear Factory  Cars Official MusicVideo 
1,"In Kalmikya Astrakhan Volgagrad and Dagestan there is already no food left for the locusts

   via TIMEWorld"
1,theaf comments on New evidence of Japans effort to build atom bomb at the end of WWII  
0,lucypalladino and I dont have any classes together and Im not sure if Ill be able to survive
1,To All The MeatLoving Feminists Of The World Riot Grill Has Arrived 
1,"Suicide bombing for Daesh is rightly despicable Suicide bombing for Ocalan Marxism

 They share our values "
1,Wtf this mom just drowned her child
1,Holmgren We referred to those 35 days as the hostage situation We were Lous hostages
0,Our big baby climbed up on this thing on wheelsIO HawkHis knee injury Wheres my beltMr SRK cook ur beautiful ass for punishment
0,Allah describes piling up wealth thinking it would last forever as the description of the people of Hellfire in Surah Humaza Reflect
1,Pic of 16yr old PKK suicide bomber who detonated bomb in Turkey Army trench released  
0,Check out Ameribag Healthy Back Bag Shoulder Cross Body Backpack Khaki Tan Beige Nylon  eBay
1,House Energy amp Commerce subcommittee to hold 728 hearing of CDC oversight of bioterror labs Army anthrax mishaps httÛ
0,Reddit Will Now Quarantine Offensive Content 
0,AyshunTornado then dont
1,CochiseCollege For the people who died in Human Experiments by Unit 731 of Japanese military  
1,Party for Bestival crash victim Michael Molloy on what would have been his 21st 
1,Wreckage Conclusively Confirmed as From MH370 Malaysia PM
1,Learning from the Legacy of a Catastrophic Eruption  The New Yorker 
0,Brunette teen Giselle Locke teases at home  View and download video
0,IT WAS REALLY AWFUL AND I CANT EVEN WORK WITH A MAKE UP ARTIST NOW BECAUSE THEY WILL RUIN THINGS
0,A deluge of eulogies  for CecilTheLion on my WhatsApp  this too tormented soul by matias xavier 
1,Aircraft debris found on island is from MH370 Malaysia confirms 
0,Is your team ready for a natural disaster a violent client or power outage Contact Ready Vet to design 
1,BigRigRadio Live Accident Awareness
0,National free root beer float day is tomorrow at AW from 2pmclose Help support the Wounded Warrior Project with donations 
0,nflexpertpicks Michael Floyds hand injury shouldnt devalue his fantasy stock Michael Floyds damaged digits won Û
1,greateranglia I know the cow incident not yr fault by how where they on the line could of caused a derailment
1,Refugio oil spill may have been costlier bigger than projected A Plains All American Pipeline oil spill off  
1,Today is the day Hiroshima got Atomic bomb 70 years ago   The sanitised narrative of Hiroshimas atomic bombing 
0,Choose to be happy Fire truck the rest   Review of Kick Push by JayMcLeanAuthor
0,Has an accident changed your life We will help you determine options that can financially support life care plans and ongoing treatment
0,Sign the petition davidcameron to protect bees instead of toxic chemical companies want to harm them savebees   
1,Following a catastrophic injury acute medical care takes precedent  PTSD often follows in its wake undetected 
0,"Progressive greetings

In about a month students would have set their pens ablaze in The Torch Publications "
0,MsMigot wow what convincing  compelling evidence to change my view that is climate change deniers I tend to destroy by givingEVIDENCE
1,This is one violent and belligerent storm Im enjoying watching it unfold
0,We destroyed the Zimmerman fan club on Twitter rzimmermanjr and we obliterated Renewsit reduced her to a sock acc 
0,Eh hello cover your bloody thighs your bloody cleav ÛÓ Eh hello Since when do i expose my cleavage and i on 
1,Some of the aftershocks can be just as big as the initial earthquake 
0,Deosl86 xaviermarquis Hostages are meaningless might as well just play cod search and destroy
0,np Avenged Sevenfold  Hail To The King
0,There has not been 1 real tear out of Shelli s eyes this entire episode bb17
1,A small flood with bigåÊconsequences  
0,Ignition Knock Detonation SensorSenso Standard KS161  
1,Police Officer Wounded Suspect Dead After Exchanging Shots
1,Windstorm lastingness perquisite  acquiesce in a twister retreat ZiUW 
1,Abe government said the missiles were not weapon so JSDF could provide them to the ally when collective self defense right was exercised
0,CharlesDagnall Hes getting 50 here I think Salt Wounds Rub In
0,kwislo I see her flooding at mad decent
0,"Sinkhole Selfies You Wont Believe Whats In The Brooklyn Sinkhole 
        Sinkhole Selfies You Wont Belie "
0,brookesddl I am traumatised the lil shit nearly hopped in the bloody shower with me
0,Review Dude Bro Party Massacre III  by Patrick BromleyThe title sa  
1,Refugio oil spill may have been costlier bigger than projected LA Times 
0,biggangVH1 looks like George was having a panic attack LOL
1,KinderMorgan cantwont tell cityofkamloops how theyd respond to an oil spill Trust them See Sec 42 Kamloops 
1,Cyberdemon531 i hope that mountain dew erodes your throat and floods your lungs leaving you to drown to death
1,TRUCK ABLAZE  R21 VOORTREKKER AVE OUTSIDE OR TAMBO INTL CARGO SECTION 
0,Advice from Noah Dont go running in a thunderstorm
0,Caitsroberts see U the night wee bArra to get absolutely wrecked 
1,1130BST traffic A10Paris A40 Geneva A7 Mons A1 Hamburg A2Hanover A5 Karlsruhe Gotthard nb  
0,We gone get it  get it in blood
0,New Stretcher in 5 min  by FUJIWARA Shunichiro 20150805 Technology
0,mallelis have you gotten to the postbattle wereonadesolateplanet belowtheMasonDixonLine style electro violin playing yet
0,Escape The Heat and the ORShow for a trail run on Desolation Loop youll be glad you did  
0,the windstorm blew thru my open window and now my bong is in pieces just another example of natures indifference to human suffering
1,"Keeps askin me what this means
Not like i got the answers
Plus if i say the wrong thing
This might just turn into a disaster"
1,Emergency units simulate a chemical explosion at NU Suppose a student in the research labs at NorthwesternÛ 
1,Interesting approach but doesnt replace Eyewitness video The Ferguson Case  Video   
0,new summer long thin body bag hip A word skirt Blue  
0,AmuMumuX lava you quit actin up
1,Photo Hundreds of rescued migrants await disembarkment from an Irish naval vessel at Palermo Italy  tconnellyRÛ 
1,Short of throwing them overboard himself I dont think any other leader could do much worse by refugees than TonyAbbottMHR worst pm ever
0,TeamHendrick TeamHendrick RIRInsider Fingers crossed that there will be a driver from Hendricks in Military Hospitality w neanea2724
0,I just screamed what the fuck is a hond
1,Me watching Law  Order IB sauldale305 Vine by NaturalExample 
0,The bomb was so appropriate  seen as my family and most Jamaicans love shout bullets 
0,First Tweet collided with a Selfie Pretty Sweet if you ask me 
1,USGS EQ M 19  15km E of Anchorage Alaska Time20150806 001116 UTC20150805 161116 080  EarthQuake
0, his lip as he sunk into the bed his arms crossed behind his head as he watched his Captain do a number on his body ResoluteShield
1,reuters Twelve feared killed in Pakistani air ambulance helicopter crash 
0,Cool Tips from our friends at Counterstrike Security  Sound 
0,Seriously do we have to do a tactical riot against the headquarters of Disney and Marvel
1,Damn that sinkhole on sunset
1,FedEx no longer to transport bioterror germs in wake of anthrax lab mishaps  via usatoday
0,Meet the bloody RS5 
1,Planted 390 years ago it was moved to US This Bonsai Survived Hiroshima But Its Story Was Nearly Lost  via NatGeo
0,"Lunch for the crew is made Night night its been a long day 
PeaceLoveRescue"
1,onihimedesu the whole city is trapped You cant leave the city This was supposed to be a normal sports manga wit a love triangle c
1,"Escaping her captors was the 1st step Now she must survive a deadly storm  a wildlooking recluse
BETRAYED

books"
0,Denver CO Insurance Job Claims Property Field Adjuster Catastrophe Safeco ÛÒ USA at Liberty Mutual Insurance 
1,USGS EQ M 19  5km S of Volcano Hawaii Time20150806 010401 UTC20150805 150401 1000 a  EarthQuake
1,DISASTER AVERTED Police kill gunman with hoax device at cinema   via Foxnews
0,Remove the  and Linkury Browser Hijacker  
0,CBSBigBrother ouch Clelliyou could almost hear their hopes and dreams being crushed 
0,TheEconomist Step one get that mass murderers portrait off the yuan
1,SaintRobinho86 someone has to be at the bottom of every league Tonight clearly demonstrated why the Lions are where they are  sunk
1, RoyalCarribean do your passengers know about the mass murder that takes place in the FaroeIslands every year
0,OCT336 guys these bitches aint famine then 
0,CTAZtrophe31 Everything must be OK because shes listening to Sandstorm now
0,Listen LIve  Author Interview Beth Underwood of Gravity on Military Mom TalkRadio
1,My back is so sunburned 
1,ÛÏYou see the devastation  itÛªs shockingÛÏ  Firefighters continue to battle flames in California benstracy reports Û
0,punkblunts sincerelyevelnn fall off a cliff into hell idc
0,I just heard a really loud bang and everyone is asleep great
0,Marquei como visto Game of Thrones  3x5  Kissed by Fire  bancodeseries
0,Its Even Worse Than It Looks How the American Constitutional System Collided With the New PoliticÛ 
1,Alleged East Bay serial arsonist arrested 
0,Thinking about getting a demo car with a friend and joining the demolition derby in kenosha
0,Why put out a fire thats still burning
0,Stepped outside with a drink and a cigarette and immediately locked eyes with a jogger Worlds really do collide
1,Route Complex AM Fire Update Route Complex Wildfire FIRE UPDATE ROUTE COMPLEX Thursday Morning Aug  CAFire
0,ACarewornHeart Have a good un fella sorry I wont be there to get annihilated with you 
0,RohnertParkDPS Youre another one for the history books Thank the Justice Department And by the way I havent paid income tax in 20yrs
1,"Nuclear policy of Japan without responsibility about Nuclear Disaster will repeat same failure
annonymous guardian NYTimes Reuters"
1,Tell BarackObama to rescind medals of honor given to US soldiers at the Massacre of Wounded Knee SIGN NOW  RT 
0,FoxNewsInsider All Obama is doing is giving a false time schedule on Iran testing there first bomb      Bomb  Nuclear Suicide Vest
1,Westminister Sr22 W  Knott St Trfc CollisionNo Inj 
1,Sydney Traffic HAZARD Oil spill  BANKSTOWN Stacey St at Wattle St sydtraffic trafficnetwork
1,"Truth

News
BBC
CNN
Islam
Truth
god
ISIS
terrorism
Quran
Lies "
0,can still see itblank expressioncheeks clapping in my facemarvins room playing subtlety in the back yet drowning out all the sound
1,Aashiqui Actress Anu Aggarwal On Her NearFatal Accident 
0,I donÛªt wanna touchdown just wanna make our worlds collide 
1,Strong Thunderstorm 4 Miles North of Japton Moving SE At 25 MPH Large Hail and Wind Gusts Up to 50 MPH Poss arwx 
0,Youssefyamani add Fez weather to the equation and you have the best recipe for disaster
0,Two great dawgs Dak and Jak   HAIL STATE  
1,"NoChillLukeHammings
IM SCREAMING"
0,World Class Tgirl Ass 02  Scene 4  Pandemonium 
1,11YearOld Boy Charged With Manslaughter of Toddler Report An 11yearold boy has been charged with manslaughter over the fatal sh
0,To Luka They should all die All of them Everything annihilated  Alois Trancy 
0,RT RTRRTcoach Love TrueLove romance lith  Voodoo seduction Astrology RTRRT LOTZ 911 apocalypse Armageddon 1008planetÛ
