1,Glimpses Hyderabad deluged by heavy rainfall   
1,Dying of Lyme disease Case fatality rate nearly 100 
0,Panicking because maybe my bff left me at China Bar or maybe tindering on the toilet for 20mins
1,Survival Kit Whistle Fire Starter Wire Saw Cree Torch Emergency Blanket S knife   Full reÛ  
0,Free Ebay Sniping RT  Chevrolet  Avalanche Ltz Lifted 4x4 Truck Please Favorite  Share
0,Ted Cruz fires back at Jeb  Bush ÛÏWe lose because of Republicans like Jeb  MittÛ Video   
1,LLF TALK  WORLD NEWS US in record hurricane drought  The United States hasnt been hit by a major hurricane in  
1,Near them on the sand half sunk a shattered visage lies 
1,Unlicensed teen driver among 2 killed in NC crash 
0,I eat because it makes my mouth explode with joy and my soul rise upwards   
0,Blizzarddraco LoneWolffur also me please I would very much like a link
0,ZachLoweNBA there are a few reasons for that but one of them is the constant Drake inundation  Extremely annoying  If Drake lands us a
1,78 passengers evacuated safely after Green Line train derails 
0,Psalms 3422 The Lord redeemeth the soul of his servants and none of them that trust in him shall be desolate
0,I get this feeling that society will collapse or implode So dont be a hero and play your part
0,Hollywood Movie About Trapped Miners Released in Chile 
1,Two hours to get to a client meeting Whirlwind of emotions with this tubestrike
0,Pakistan Supreme Court OKs Military Courts to Try Civilians The Supreme Court ruling would empower the milita 
1,Metro acting chief Jack Requa says train that derailed was a sixcar train with 1000 and 2000 series rail cars wmata
0,Tomorrow is the day we start armageddon preseasonworkouts 
0,ByTorrecilla Torrecilla We Always info the Secret on LoL Game Check the Secret to get 600000 Riot Points on my Bio
1,Tension In Bayelsa As Patience Jonathan Plans To Hijack APC PDP  
1,BigSim50 nah Philly pundits are half the cause They set buildings on fire to report on buildings being on fire
0,I SCREAMED AT THE END OAMSGAJAGAHAHAH IM LAIGHIGN OTRAMETLIFE  
1,News Families to sue over Legionnaires More than 40 families affected by the fatal outbreak of Legionnaires 
0,HearItFromPatty Also pls help us w our campaign to warn the public about the hazardous keratin treatments The Brazilian Blowout COPYCATS
1,PhilipDuncan breakfastone People annihilated by last nights weather Really Philip thought you would have forecast that
1,Not only does he know the latest research the kiddos GI specialist sang the volcano number from Inside Out Now THAT is whole person care
1,Former Township fire truck being used in Philippines Township of Langley assistant fire chief Pat Walker spen 
1,As a result of heavy rains in Bangladeshaffected lands are inundated by flood watersland looks like rivers at high tide BangladeshFlood
1,Traffic Collision  No Injury I5 S at I5 S 43rd Ave offramp South Sac 
1,White family supposedly representing Americas GREAT values  gets blown up in a horrible CGI nuclear strike LMFAOOOO
0,I rated Catastrophe 2015 810  IMDb  hilarious 
1,The Catastrophic Effects of Hiroshima and Nagasaki Atomic Bombings Still Being Felt Today 
1,Armageddon 
1,Manuel hoping for an early Buffalo snowstorm so his accuracy improves
0,KarinaGarciaxo me  you both  Ill be dam if I get any of that drought bud
1,The shooting or the airplane accident  
1,The RCMP are reporting fatalities and serious injuries as a result of the collision on the TCH near Whitbourne
1,Police kill hatchetwielding gunman who opened fire inside Nashville movie theater AåÊmiddleaged manåÊarmed wi 
1,ÛÏFDNY This morning FDNY responded to a sinkhole in Brooklyn Units remain onscene with NYCBuildings  others 
0,That took way longer than I expected
0,dating meet sex Hot Teen Ass Exploded By Fat Cock 
0,I liked a YouTube video from zaire2005  SPECIALGUEST CRAPGAMER RECAP MICROSOFT DESTROYED SONY AT GAMESCOM
1,Police Gunman reported dead at Nashville area theater A suspect who carried a gun and a hatchet at the Carmi 
1,CDC has a pretty cool list of all bioterrorism agents 3
0,HereÛªs how media in Pakistan covered the capture of terrorist Mohammed Naved 
1,going to redo my nails and watch behind the scenes of desolation of smaug ayyy
0,Best movie youve ever seen  Armageddon  
0,NEW Snap On Tools Black baseball HatCap SilverGray Embroidered S Logo Flames  Full reÛ  
0,Fairfax investigating firefighter over Facebook post saying police should be put in Û÷body bagsÛª  The Washington Post 
1,NTSB Virgin Galactics SpaceshipTwo crash due to structural failure when braking system unlocked early  via KPCC AP
0,Just added some more fire to the flames for Saturday Rick Wonder will be spinning a guest set along with Chachi 
0,Smoke it all 
0,Training grains of wheat to bare gold in the August heat of their anger Im the no trespass lest you seek danger
1,SSP East says a car AEG 061 driven by a young man collided with Akrams carhot words were exchanged n he did firing in air1bullet hit tyre
0,2015 new fashion ladies gold watch waterproof WeiQin famous brand michel quartz de lujo caÛ  
1,Reddits new content policy goes into effect many horrible subreddits banned or quarantined  
1,Wild fires freak me the fuck out Like hell no
1,APANO55 JamesMelville 99 of Scientists donÛªt believe in Catastrophic ManMade Global Warming only the deluded do
0,My Instagram just blew up apparently I was featured on I am jazz tonight How cool is that love her
1,RT nAAYf First accident in years Turning onto Chandanee Magu from near MMA Taxi rammed into me while I was halfway turned Everyone confÛ
0,Owner of ChicagoArea Gay Bar Admits to Arson Scheme Frank Elliott pleaded guilty to hiring an arsonist to to 
1,Egyptian Militants Tied to ISIS Threaten to Kill Croatian Hostage New York Times  1717 GMT
1,DUNDEE NEWS Army veteran fears loose rocks from Dundee landslide could kill him at any moment 
0,So these savages leaked Thomas Brady gangstermail account and wonder why he was quick to fatality his Samsung mobile B real son
0,CortezEra I dead ass screamed when we signed him I couldnt fucking believe it
1,Skinny Jeans are Hazardous for Your Health socialnews 
0,TRjdavis Bruh you wanna fight Im down meet me in the cage bro better find out who youre dealing with before you end up in a body bag
0,America like South Africa is a traumatised sick country  in different ways of course  but still messed up
0,"ThingsIhate 
Watching someone you care about head into total destruction and not being able to do anything"
1,Bomb squad set to detonate backpack Antioch Tenn theater gunman had on him officials say  Tennessean 
0,Has An Ancient Nuclear Reactor Been Discovered In Africa ÛÒ Your 
1,Criminals Who Hijack Lorries And Buses Arrested In Enugu PHOTO DONJAZZY PoliceNG HumanRights  
0,Luzukokoti its all  about understanding umntu wakho If you do and trust your partner then y OK u will know and wont fear to do anything
1,Typhoon Soudelor approaches after 7 killed 2 missing in floods in PhilippinesÛ  Typhoon
0,I spent 15 minutes lifting weights 43 calories burned LoseIt
0,Im sinking down in the darkest dream so deep so cold this pain inside of me my love for you is more dan I can bear Jota Esse
0,Check these out     nsfw
0,Its raining outside Im burning my favorite candle and theres hot cocoa to sip Nap time  awesomesauce
0,Someone split a mudslide w me when I get off work
0,Set our hearts ablaze and every city was a gift And every skyline was like a kiss upon the lips Û 
1, Residents Return To Destroyed Homes As Washington Wildfire Burns on 
0,DnB NewRelease EDGE Jimmy  Summer Rainstorm Lapaka Sounds  via 
0,TunesWGG lol U got wrecked
1,The Latest More homes razed by Northern California wildfire   
0,If GOP want to destroy America then Obama is dilutional I should be institutionalize or sued for slander  
0,Russian authorities to take account of petition against destruction of sanctioned food Vladimir Putins press 
1,Û÷Faceless body belonged to my sisterÛª Hiroshima Nagasaki nuke survivors recall horrors 70 years on ÛÓ RT News 
0,If she dont know bout that Pandemonium album Shestooyoung
0,raineishida lolIm just a nervous wreck P
0,Feel like Ive been flattened by a sumo wrestler  no pain no gain muaytai wantmyabsback strong 
1,Malaysia Airlines Flight 370 that Disappeared 17months ago Debris Found South of The Indian Ocean  
1,CLEAREDincident with injuryI495  inner loop Exit 31  MD 97Georgia Ave Silver Spring
1,Plane debris discovered on Reunion Island belongs to flight MH370 ÛÒ Malaysian PM 
1,watching it go up in flames
1,Going to a fest Bring swimming goggles for the dust storm in the circle pit
1,Calgary area tornado warnings end as thunderstorms move eastward  CBCca CBCca Calgary area tornado warnings endÛ 
0,TheEllenShow Please check into Salt River horses help stop the annihilation about to happen without 54000 more signatureschange org Thx
0,"fun instagramers 

Jeb Bush said earlier this week that not only does he want to obliterate Planned Parenthood buÛ"
0,Nigga car sinking but he snapping it up for fox 13 priorities 
1,Update Bend FD says roofing co workers accidentally cut through natural gas line in Post Office leading to evacuation for about a halfhr
0,Calgary news weather and traffic for August 5   90  
1,INEC Office in Abia Set Ablaze  
0, efs300  Star Wars and Star Trek Collide on Pluto Moon Charon pluto
1,EazzyP we will never know what would have happened but the govt seemed to think that their beliefs warranted the deaths of innocent japs
1,US wont upgrade its infrastructure  it a bad situation and its going to get ugly very quickly USA sustainability
0,RT FreeDiscountBks Desolation Run FREE till 87  Military Thriller Suspense Kindle amreading 
1,Obama Keeps 27 Iraqi Christian Asylum Seekers nDetention While Flooding US wUnscreened Muslims  via DCClothesline
0,The good thing is that the Royals wont face a newbie in the playoffs No real reason to panic
1,"852015  430 PM  Progress Being Made on Boise Forest Fires
 "
0,Lmao that light skin guy blew up on Twitter by talking about how ugly he was as a kid
0,When you get a bomb ass picture mail 
1,Two giant cranes holding a bridge collapse into nearby homes 
0,DaneMillar1 screams 666
0,Crushed the gym then crushed a butterfinger flurry clearly my priorities are straight 
0,"lmao fuckboy changed his  for damage control
Pseudojuuzo"
0,If you dotish to blight your car go right ahead Once its not mine
0,IM GONNA GET NAKED AND SMOKE MY CIGARETTE someone call me radneck or is it just too hot in here
0,BUT I will be uploading these videos ASAP so you guys get to see the new weapon types in action
0,dopeitsval ahh youre bomb baby 
1,followlasg This is urgentthere is currently a 3 storey building at church Bstop Oworoshoki Third mainland bridge which likely to collapse
1,EUROCRISIS Guardian Greeces tax revenues collapse as debt crisis continues As talks continue over proposed âÂ 
0,World Class Tgirl Ass 02  Scene 4  Pandemonium 
0,se pone a cantar crying lightning
1,Hundreds feared drowned as migrant boat capsizes off Libya 
0,ÛÏLeoBlakeCarter This dog thinks hes an ambulance  
1,17 people displaced after 3alarm fire tore through 2 apartment buildings on Second Street in Manchester   MHT
0,Ever since Kellys burned I keep having dreams about being inside burning buildings 
1,Reddit  Lightning sparks new fires in Boise National Forest rStormComing
0,FORBES Chinas Stock Market Crash Are There Gems In The Rubble ChinaÛªs stock market crash this summer ha 
1,Malaysia confirms plane debris washed up on Reunion Island is from Flight MH370 
0,What is the role of usg in paeds major trauma imaging decision tool FOAMed FOAMcc
1,A sinkhole grows in Brooklyn sixmeter crater swallows street 
0,Lifestyle Û÷It makes me sickÛª Baby clothes deemed a Û÷hazardÛª  
0,"Natalie Stavola our costar explains her role in Love and Hostages Check it out LHmovie indiefilm comingsoon
"
0,Free Kindle Book  Aug 37  Thriller  Desolation Run by jamessnyder22 
1,Media Release  Firefighters Ask Hikers to Signin at Local Trailheads Parker Ridge Wildfire Parker  IDFire
0,"If your friends really were your friends theyd support you regardless of your decisions

Unless you become a massmurderer or something"
0,Thats the ultimate road to destruction
0,olrules Welcome  Read a free chapter of my new book Encounters With Jesus Its full of hope 
1,VIDEO Were picking up bodies from water Rescuers are searching for hundreds of migrants in the Mediterranean after a boat carryi
0,NowPlaying Last Smoke Before The Snowstorm by Benjamin Francis Leftwich  hopefully new album coming soon   
1,"abc3340 
Parents of Colorado theater shooting victim fear copycat massacre


Antioch

"
0,Once upon a time the fact that I decided to go to university 7 hours away actually sunk in
0,DavidCovucci We cant because a sinkhole swallowed every taco place in the neighborhood
0,three episodes left the end is nigh
0,Wow He crushed that EDWING BlueJays
1,Debris found on Reunion Island comes from MH370 Malaysian PM 
1,The City has activated the Municipal Emergency Plan Primarily stay indoors avoid flooded areas Call 311 for 
0,New Mad Max Screenshots Show Off a Lovely Dust Storm Combat Magnum Opus  cogXbox XboxOne Xbox
0,Join the Providence Health  Services team See our latest Nursing job opening here  Torrance CA Hiring
0,Whimsy as it pertains to mass casualties Always impressive
0,Im slightly traumatised after this weeks one born
0,"Does this apply to Muslimsterrorism
Or Catholicismhomophobia"
1,Investigators shift focus to cause of fatal Waimate fire 
1,Obama Declares Disaster for TyphoonDevastated Saipan Obama signs disaster declaration for Northern Marians a 
1,Nepal earthquake 3 months on Women fear abuse  via loupascale
1,We happily support mydrought  a project bringing awareness to the LA drought Track your waterÛ 
0,youre the snowstorm Im purified the darkest fairy tale in the pale moonlight
0,Rory McIlroy to Test Ankle Injury in Weekend Practice chinadotcom sports  
0,"Who is bringing the tornadoes and floods Who is bringing the climate change God is after America He is plaguing her
 
FARRAKHAN QUOTE"
0,missambear your Tweet was quoted by WIRED  
0,Elsa is gonna end up getting electrocuted Shes gonna end up like that cat from christmas vacation
1,Pic of 16yr old PKK suicide bomber who detonated bomb in Turkey Army trench released  
0,KurtSchlichter FALPhil This liberal compassion is BS A specific Feminist said the US bombed Japan back to traditional sexist values
1,Israel continues its demolition of Palestinian homes gop potus irandeal isis  
1,MH370 debris found on reunion island  sad tragedy innocent crash mh370
0,Dont say ALIPAPER women got problems this keepingtheviginaclean thing is very interesting n less expensive metrofmtalk
0,Imagini noi si 2 clipuri The Hobbit The Desolation of Smaug   cliptv desolationofsmaug poze thehobbit
1,President Barack Obama has on air meltdown over opposition to Iran nuclear deal  via examinercom
0,Squeaver just hangin out in star buck watchin my boy wreck this septic tank
0,"mom we didnt get home as fast as we wished 
me why is that
mom there was an accident and some truck spilt mayonnaise all over "
0,Chinas Stock Market Crash Are There Gems In The Rubble    
0,Cherry print  matching lipstick just rediscovered NarsÛª Û÷Heat WaveÛª by emilyschuman 
0,Ashes 4th Test 10 Hilarious Twitter Reactions to Australias collapse  by AbsolutSumya15
0,RedCoatJackpot As it was typical for them their bullets collided and none managed to reach their targets such was the curse of a 
1,BrookTekle didnt look like a murder scene just 1 cops a fire truck and 2 fire assistance cars along with a helicopter
1,OMFG there are bush fires all over this tiny island Our freaking house is gonna burn down
0,INVESTMENT NEWS Keurig Green Mountain Inc ThirdQuarter Earnings Shares Sinking AfterHours  Stocks in the NewÛ 
0,Morgan Silver Dollar 1880 S Gem BU DMPL Cameo Rev Blazing MS High grade  Full read Û  
0,RJG0789 idkI feel like his movies have done more harm than good They make us look sterotypical annddd colorism is prevalent sort of
1,JoeDawg42 TOR for a TOR situation only Wind damage enhanced wording is key IMO
1,Hundreds of migrants feared drowned off Libya Migrants stand next to their tent at a camp set near CalaisÛ 
0,"Its been raining since you left me
Now Im drowning in the flood
You see Ive always been a fighter
But without you I give up"
0,Hellfire is surrounded by desires so be careful and donÛªt let your desires control you Afterlife
1,Fully Engulfed Garage Fire Propane Tanks Inside Sunnymeade Dr
0,wHeREs mY aRsOnISt aT
0,Finnish ministers Fennovoima nuclear reactor will go ahead 
0,jakeblight WeAlIlKnowA you cunt
1,The Prophet peace be upon him said Save yourself from Hellfire even if it is by giving half a date in charity
0,McFadden Reportedly to Test Hamstring Thursday via TeamStream 
0,"RAIN RAIN GO AWAY A soaker is on the way 
   "
0,bigperm28 was drafted by the Avalanche in 2005 rd 4 124 overall Played last season in UtahGrizz 
0,Aftershock 
0,Man Cam just demolished his plate His ass was hungry
0,Packing for CT aka my room looks like a war zone
0,And the fact that i have a curfew
1,TweetLikeItsSeptember11th2001 Those two buildings are on fire
0,SCREAMING IN 22 DIFFERENT LANGUAGES 
0,JJDIRTY MLSTransfers greggmair oh Gio was my backup But with SKC next and BWP getting a crack at NYCFC  injury I went BWP Lol wrong
0,ITS JUST NOW SINKING IN THIS IS THE LAST EPISODE MY HEART HURTS SO BAD
0,Guys I have an Imouto Who Isnt Actually Related to Me by Blood
0,First Time Playing Hearthstone on PC Thoughts 
1,SocialWOTS GLOBIinclusion RT NRCMiddleEast Sandstorm engulfs caravans and tents in the Zaatari refugee camp Û 
0,women crush  
0,NoahCRothman Bore him with minutiae serve bad champagne He may just explode
1,Las Vegas in top 5 cities for redlight running fatalities 
1,IT STARTS A FOREST FIRE THAT CANNOT BE PUT OUT 
1,Storm headed towards Idaho Falls with blowing dust  winds to 60 mph  US HWY 20  I15 look out  idwx 
0,How to restore vinyl siding and make it look new again  
0,16 TIX Calgary Flames vs COL Avalanche Preseason 929 Scotiabank Saddledome 
0,cwheate hahaha Im half traumatised half hoping my labour is that easy 
1,Bestnaijamade 16yr old PKK suicide bomber who detonated bomb in   bestnaijamade bestnaijamade bestnaijamade beÛ
1," LatestNews CNBC CNN

The anniversary of the devastation wrought by the first military use of an atomic weapon cÛ"
1,BLOG Rain much needed as drought conditions worsen Right now Charlotte and much of the surrounding area haveÛ 
0,rosewell it has crashed so many times the past couple hours
0,The hurricane mixxtail kinda tastes like the watermelon four loko  brittsand9
0,CrowtherJohn Effiedeans  you just keep ur head in the sand john The best place for it  Lbr after 97 landslide Couldnt imagine situ now
1,There some flash flooding in madison valleywx
1,Rly tragedy in MP Some live to recount horror ÛÏWhen I saw coaches of my train plunging into water I called  
0,Picking up a man in a bar is like a snowstorm you never know when hes coming how many inches youll get or how longll hell stay
0,Angry Woman Openly Accuses NEMA Of Stealing Relief Materials Meant For IDPs An angry Internally Displaced wom 
0,I slammed my phone to the ground and then screamed ahahahga
1,bbcmtd Wholesale Markets ablaze 
0,Im so sad Kids Company has closed After all the talk thousands of traumatised young people will suffer But 
1,I will never support looting or the burning of buildings but when seeing the people fight back against the police I was proud
0,This bed looks like a war zone
0,One Direction Is my pick for  Fan Army Directioners  x1411
0,Talk on GOZ is fantastic Most interesting fact so far is that they manually bought all the ru domains to sinkhole rather than seek coop
0,But no lies though Its pays to be the oldest sometimes Like being the first to get a car and have no curfew freedom donthate
1,Expect gusty winds heavy downpours and lightning moving northeast toward VA now 
0,Great British bBakeb Offs back and Dorrets bchocolateb gateau collapsed  JANÛ 
1,Rainstorm Destroys 600 Houses In Yobe  iReporter  via sharethis
1,GettingLost JennEllensBB Munclejim It said they had superficial wounds and it was the pepper spray that did the most damage
0,Crushed it 
0,58hif my trick is to think about nasty things
1,TheSmallClark Hell kill me instead if he survived the shot I dont exactly know I fled the scene and pulled the trigger with
0,The injuries are starting Please dallascowboys stay healthy 
1,Final Medinah update shot a 105 49 on front exploded with a 56 on back ImKeepingMyDayJob pic is famous 17 
1,Californian Bush Fires 2015 
0,Remove the  and Linkury Browser Hijacker  
1,"
Warfighting Robots Could Reduce Civilian Casualties So Calling for a Ban Now Is Premature  IEEE Spectrum "
0,Texas Seeks Comment on Rules for Changes to Windstorm Insurer  insurance
0,Womens Buckle Casual Stylish Shoulder Handbags Pockets Cross Body Bags Green 
1,Our Chemical Spill Cleanup videos will prepare you for an emergency situation in the lab 
0,Being able to stay out of work this week to take online courses for the Property and Casualty StateÛ 
0,BrodyFrieling hannabrooksie photo bombed
1,American Weapons and Support Are Fueling a Bloody Air War in Yemen 
1,As of the 6month mark there were a total of 662 fatalities  114 more than the first half of last year  
0,entertainment Hollywood movie about trapped miners released in Chile SANTIAGO Chile AP ÛÓ The Hollyw  news
0,I added a video to a YouTube playlist  Natural Disaster Survival  HUG BY A GUEST on Roblox
0,that horrible sinking feeling when youÛªve been at home on your phone for a while and you realise its been on 3G this whole time
0,Blaaaaaaa he said as he sunk his face into your stomach making it vibrate ResoluteVanity
0,If youre gonna take a break at work you gotta do it right CarlilesCanoeLivery LoveMyJob 
0,GOP debate drinking game For anyone looking for a bit of fun while watching this train wreck  
0,Diageos CEO stresses that a board revolt at United Spirits has not impacted Indian operations 
1,The Dress Memes Have Officially Exploded On The Internet 
0,"Do you have a plan Emergency Preparedness for Families of
Children with Special Needs    autism specialneeds"
0,I love the song healing is heredeluge wanted to sing it at my church but its not in spanish so I translated it 
0,Man selling WILD MORELS at Ambleside Farmr MartSunMUSHROOM forageSECRET IS TO KNOW WHAT TREES they grow under  BEST AFTER FOREST FIRES
0,I liked a YouTube video from skippy6gaming  Minecraft PS4  3 X 2 LAVA DOOR  How To  Tutorial  PS3  XBOX
0,She just said does he have a curfew nope
0,6Beyonce Is my pick for  Fan Army Beyhive 
0,baskgod body bags
1,pattonoswalt FoxNews Wait I thought Fecal Hurricane was on SciFi Maybe that was turdnado Ive been forgeting up a shit storm lately
1,Im sorry but if you have to resort to weapons to settle something youre a pussy win or lose take your shit like a man  leave it at that
0,Detonation fashionable mountaineering electronic watch waterresistant couples leisure tabÛ  
1,Madhya Pradesh Train Derailment Village Youth Saved Many Lives
0,I liked a YouTube video  Thorins Thoughts  Riot and Sandbox Mode LoL
0,A Marshall Plan for the United States by Dambisa Moyo via ProSyn oped  via post
1,ÛÏA voluntary evacuation is being recommended at this timeÛ for Pickerel Lake cabins across highway from Reidlake fire says MACA NWT YZF
1,hornybigbadwolf sets the forest on fire
1,MEG issues Hazardous Weather Outlook HWO   WX
1,    MH370 Aircraft debris found on La Reunion is from missing Malaysia Airlines   
1,When you go to a concert and someone screams in your ear Does it look like I wanna loose my hearing anytime soon
0,ThatWitchEm EmmaChosenOne JessieNovoaRP JessieNovoa LianaNovoa why you screamed
1,I wanna set some shit on fire
0,StephanieMarija light rain was the forecast I based my dressing on Light Rain Not incessant deluge
1,A Daytonarea org tells me it was hit by a cyber attack 
0,People are finally panicking about cable TV 
1,Large sinkhole swallows entire pond in Lowndes County Georgia Large sinkholeÛ  Occasion2B
0,Beastin Tapas this evening with some good folk funtimes demolished 
0,1970 Mercury Cyclone GT Hood Moulding Very NICE CORE Cobra Jet 429CJ GT  
1,I dont understand taking ANY life as a trophy Its violent killing  CecilTheLion BADChoices BANTROPHYHUNTING
0,Death certificates safes weapons and Teslas DEF CON 23 Security 
0,My dad is panicking as my weight loss means he needs to hurry up with my new clothes fundwhen I reach my goal  
1,News Refugio oil spill may have been costlier bigger than projected 
0,noahshack hes hot  he can sing Im screaming
1,exporting food wont solve the problem africans will end famine n poverty by SOLVING OUT OF CONTROL TRIBAL WARS 
0,Nah but srsly b4 u demolish ur partners face start dribbling up their nostrils stop ask urself whether its really worth the embarrassment
0,Why did God order obliteration of ancient Canaanites 
0,TheBoyOfMasks Thanks again for letting me stay here since the manor was blown up Anyways how are you doing buddy
1,Watch This Airport Get Swallowed Up By A Sandstorm In Under A Minute 
1,"Flooding kills 166 displace over one million in Pakistan 

At least 166 people have been killed and nearly 11 lakhÛ"
1,FedEx no longer to transport bioterror germs in wake of anthrax lab mishaps 
0,QuotesTTG Save the panicking for when you get to Helios 
1,70 Years After Atomic Bombs Japan Still Struggles With Wartime Past The anniversary of the devastation wroug 
0,Officially skipping out on FantasticFourFant4sticwhatever the hashtag is Its getting ANNIHILATED in reviews Bummer
0,RT NotExplained The only known image of infamous hijacker DB Cooper 
